1;0;0;0;0;#lagabbia La colpa dell'alluvione secondo un razzista del pubblico sarebbe degli extracomunitari che costano troppo. E nessuno l'ha zittito
1;0;0;0;0;A Matera hanno sbagliato la data per il maltempo. Al sud fanno le cose così, non sanno programmare. Neanche i media nazionali hanno seguito la disastrosa alluvione! Così imparano!!! https://twitter.com/Gianni_Pisa/status/1195471101956104194 …
1;0;0;0;0;13-14 novembre 1951 Polesine(province di Rovigo e Venezia). Disastrosa alluvione del Po, ~100 morti,180.000 senza tetto. Il fatto avvenuto a soli 6 anni dalla fine della conflitto sarà causa di ulteriore povertà.Decine di migliaia lasceranno il Polesine senza farvi più ritorno. pic.twitter.com/un2UHF5OAM
1;0;0;0;0;Io #LaraComi voglio ricordarla così, quando all’indomani dell’alluvione in Sardegna del 2013 sbottó “Cosa ci facevano le VITTIME in uno SCANTINATO?!” Ma quello scantinato era la loro CASA Lauré, non erano scesi in cantina a prendere una bottiglia di Chianti. Ciao Lauré Ciao vah
1;0;0;0;0;Nell’anniversario dell’Alluvione dei fiumi #Arno, #Serchio e #Ombrone del 4 novembre 1966 con il Sindaco @DarioNardella e il Capo del @DPCgov abbiamo ricordato le 37 vittime rinnovando l’impegno nel mantenere sicuri i fiumi della nostra #Toscana!pic.twitter.com/EOyEcBazrg
1;0;0;0;0;Inevitabile ogni #4novembre 1966 Alluvione di #Firenzepic.twitter.com/uswiqZaGnZ
1;0;0;0;0;Un Paese che investe poco nella protezione del suolo è destinato a registrare morti e danni a ogni #Maltempo L'Italia ha bisogno di una vera ristrutturazione globale non interventi emergenziali post #Alluvione Vicino alle popolazioni piemontese e genovese pic.twitter.com/6FS5ZKhdQN
0;0;0;0;1;Siamo con l’acqua alle ginocchia. Imbarazzante non prevedere. #alluvione #allertameteoPIEpic.twitter.com/k9QL2OxIEW
1;0;0;0;0;Nel decimo anniversario dell'alluvione che ha colpito la riviera Sud di #Messina, desidero rivolgere un commosso pensiero alle trentasette vittime innocenti. [...] https://www.facebook.com/216178258459587/posts/2426643754079682/ … #Sicilia #Giampilieri #ScalettaZanclea #governoMusumeci @Regione_Siciliapic.twitter.com/knchVYIu5b
1;0;0;0;0;Noi #toscani siamo così. Abbiamo tanti difetti ma di fronte alle difficoltà degli altri non ci giriamo dall'altra parte come questi aretini che alla tragica alluvione hanno reagito subito con forza, determinazione e orgoglio senza piangersi addosso aiutando il Parroco #arezzopic.twitter.com/lATgjXdyAq
1;0;0;0;0;"Firenze #patrimoniomondiale ricorda il maestro Franco Zeffirelli con il suo documentario ""Per Firenze"" dedicato all'Alluvione del 1966. Florence #worldheritage remembers Franco Zeffirelli trough the documentary ""Per Firenze"" dedicated to the 1966' flood. https://www.raiplay.it/social/video/2016/10/Per-Firenze-di-Franco-Zeffirelli-00791dd0-81df-4360-baa3-cda9901a3022.html …pic.twitter.com/ksiolAY19b"
1;0;0;0;0;Molto più di un luogo comune: un progetto per dare nuovo corso allo spazio dell’Imbarchino all’interno del Parco del Valentino di Torino distrutto da un’alluvione nel 2016 http://bit.ly/2Hm3mZY  #culturability5 @RadioBandaLargapic.twitter.com/OrguCKHU62 – presso Base Milano
0;0;0;1;0;Muretto del lungomare do Livorno portato via dall'alluvione 9/9/2017, il 18/4/2019 è ancora così. Amministrazione M5S, una garanzia per celerità e efficienza (citofonare Raggi per conferme). pic.twitter.com/GoJaOJKmUl
1;0;0;0;0;6 Dopo l'alluvione del '66, Ragghianti si mobilita per la tutela dei capolavori contemporanei #followamuseumpic.twitter.com/0G34O8C1Bf
0;0;0;1;0;27 ore di treno bloccati a #Cannes per l'alluvione, Don Pirri #preghiamopervoi e i malati in pellegrinaggiopic.twitter.com/cFJbDe6SNs
1;0;0;0;0;La spiaggia di San Fruttuoso è frutto di un'alluvione del 1915! #vinidamare2015pic.twitter.com/SiNQEIVgLN
1;0;0;0;0;#Renzi che si tenne ben lontano dalla città nei giorni dell'alluvione,a #Genova a far passerella, per l'apertura del cantiere sul Bisagno
1;0;0;0;0;#alluvione i comuni che avevano beneficiato della sospensione delle #tasse sino al 20.12 dovranno pagare tutto entro il 22.12 #auguri (1/2)
1;0;0;0;0;#sky invita la gente a mandare video dell'alluvione. Così loro risparmiano e la gente affoga per sentirsi reporter, la colpa poi al sindaco
1;0;0;0;0;La dignità della gente..la forza di una città!la situazione è migliore ma serve aiuto! #Parma #alluvione @ComuneParmapic.twitter.com/kV81mv2ykH
1;0;0;0;0;#parma #alluvione la storia si ripete. Ma non c'erano le casse di espansione? @lapaolabriapic.twitter.com/Yhtv7jCtbx
1;0;0;0;0;l'alluvione di Genova ricorda nevicata a Roma di 2 anni fa. @AlemannoTW denució l'assenza della protezione civile, ma non fu ascoltato.
1;0;0;0;0;Cara Barbara ( @carmelitadurso) non mandare le immagini dell'alluvione del 2011. Fail. #AlluvioneGenova #Pomeriggio5
1;0;0;0;0; @ilsecoloxix: #AlluvioneGenova questa la situazione di #Sturla. http://bit.ly/1s0xoEv  pic.twitter.com/spobCyknHR @paoladelusa alluvione
1;0;0;0;0;Mi leggo i tweet che mi ero persa di @EzioMrLifestyle e @Infoturismiamo in visita al Gargano colpito dall'alluvione! #ilgarganovive
1;0;0;0;0;L'alluvione del 94...direi che è arrivato il momento di mettere ordine #chilhavisto
1;0;0;0;0;Decreto alluvione in gazzetta ufficiale. Risarcimento danni x famiglie e imprese #alluvioneMo
1;0;0;0;0;Domani si parte cn la nostra campagna a piedi,la campagna #slowfoot.si comincia cn @civati a Bomporto(MO)alle 14,zona colpita dall'alluvione
1;0;0;0;0;Con il decreto del Governo tutti i cittadini colpiti vedranno riconosciuti e risarciti i danni provocati dall'alluvione in Emilia-Romagna.
1;0;0;0;0;Roma: buche, tombini ostruiti, alluvione di foglie: la priorità del comune deve essere la manutenzione efficace di ciò che c'è.
1;0;0;0;0;L'alluvione dimenticata Modena affoga nel silenzio, fra sisma e nubrifagi nessuno ne parla il re e il governo dietro la legge elettorale.
0;0;0;0;1;85 kmq di territorio allagato. E il silenzio dei media è scandaloso. Ci aspettiamo l'assoluta immobilità del governo. #alluvione #Modena
1;0;0;0;0;Centro di coordinamento di #Modena della Protezione Civile -> TEL 059200200 #alluvioneMO #Alluvione http://bit.ly/1dLSu4M  @triomedusa
0;0;0;0;1;#alluvione #allertameteoER #help #modena #secchia #panaro #emergenza @Modenaonline @ModenaTwit GRAZIE @AlleTattoopic.twitter.com/6qfAYqprj2
1;0;0;0;0;In poco più di un anno: terremoto, tifone e ora alluvione. Ma Modena non molla mai. #Alluvione #Maltempopic.twitter.com/TzscZdUUWS
1;0;0;0;0;Atterrati ora. Domani contro la #dinamosassari..ma il pensiero ora va solo alla gente che soffre dopo l'alluvione! #nonMollareSardegna
1;0;0;0;0;Ora è il momento del silenzio e del lavoro, non della polemica. Ma le cose che ho da dire sull'alluvione in #Sardegna le sto segnando. Tutte
1;0;0;0;0;L'Italia è quel paese in cui si dichiara il lutto nazionale per 200 immigrati, ma non per 16 sardi, figli della nostra terra. #alluvione
0;1;0;0;0;Questa alluvione é figlia anche dei devastanti incendi della scorsa estate. Meditate piromani, ignoranti ed infami assassini. #Sardegna
1;0;0;0;0;Più che ricordare i giovani armati del 1918, oggi vorrei ricordare quelli sporchi di fango che ripulirono Firenze dall'alluvione del 1966
1;0;0;0;0;25.10.2011 25.10.2013 La #lunigiana non dimentica #alluvione #maipiù
1;0;0;0;0;Genova - Per semplificare le procedure in caso di alluvione, il Comune ha scelto i colori per il rischio: Cremisi, Ocra e Smeraldo.
1;0;0;0;0;“ @NicolaZizou: 1 ottobre, 4 anni dopo ricordando l'alluvione a Giampilieri...” Bertolaso quel signore fece credere che era un paese abusivo
1;0;0;0;0;L'alluvione su di noi, stringimi più che puoi fuori il tempo sta finendo non parlare se non vuoi
1;0;0;0;0;Diffondete l'hastag #sosalluvione !!! Tutti devono sapere dell'alluvione di #Vicenza #rt
0;0;1;0;0;#alluvione #vicenza l'acqua finora rimane solo sul cortile e scorre fuori dal cancello.. il #pensionatostudenti è ancora salvo, per ora...
0;0;0;0;1;Passare in posti e vedere acqua che arriva a 3mt vedere lampeggianti in ogni angolo di sanbo è da pelle d'oca #alluvione #sanbonifacio
1;0;0;0;0;La signora toscana che ha perso la casa nell'alluvione è contenta che si stia parlando del dramma di Mora e di Ruby. Eh già... #piazzapulita
1;0;0;0;0;Stamani si è presentato al #LetsGoBar scampato da un'alluvione. Era impaurito e zuppo. Potevamo non aiutarlo? pic.twitter.com/ozhoKDoU
0;0;0;0;1;No, credo proprio che non andrò a comprare il latte... #alluvione #tevere #sabinapic.twitter.com/na17MIRs
0;0;1;0;0;appena oltre la carreggiata, un mare di pioggia, piatto e laccato, specchia i boschi annegati di orvieto. #alluvione
0;0;0;1;0;Chiamano disastri naturali anche l'assenza totale di manutenzione, di prevenzione e l'urbanizzazione selvaggia. #alluvione
0;0;0;1;0;#alluvione #Vicenza #Padova #Verona SERVONO SUBITO i bacini. Non può piovere per sempre, ma se piove per un giorno non si può tremare
1;0;0;0;0;Prevista alluvione di lacrime nella zona oculare :'C
0;0;0;0;1;Fuori c'è l'alluvione e in Cucina da magnare c'è rimasto #cap'e'cazz
1;0;0;0;0;La gente ha ricostruito da sola i paesini colpiti da alluvione.. Non le autorità
1;0;0;0;0;Noi del Sud, tutti uniti, non potete neanche immaginare quello che possiamo fare... #messina #Bpdg #alluvione #sud http://twitpic.com/7l6ryb 
0;0;1;0;0;“ @doonie: Roy Paci, in mezzo ai volontari di Barcellona Pozzo di Gotto a spalare fango dopo l'alluvione. http://fb.me/WuJRbIJO ” GRANDE!!
1;0;0;0;0;SMS al 45500 per aiutare le persone colpite dall'ALLUVIONE in Liguria e Toscana!!! Fate girare @rivoluzionen9 @silviomuccino @VanityFairIt
1;0;0;0;0;SMS al 45500 per aiutare le persone colpite dall'ALLUVIONE in Liguria e Toscana!!! Fate girare @nicolavitiello @NicoSavi @pallavolofiore
1;0;0;0;0;“ @CarloMio: @sarofiorello Per i nostri amici liguri e toscani #ALLUVIONE sms 45500 un aiuto subito di € 2 #tgla7 #corriere”
1;0;0;0;0;“ @ninjamarketing Per cortesia condividi questo appello c'è bisogno di aiuto #emergenza #alluvione pic.twitter.com/nP26jSjB” #spezia
1;0;0;0;0;2 anni fa vacanze a Madeira e poco dopo alluvione devastante.Quest'estate vacanza alle 5 terre e...ma che niente niente porto spheega???
1;0;0;0;0;Alluvione 2008 stanziati 2 milioni di euro. Elenco e cifre dei 30 comuni della provincia di Messina colpiti in quei… http://wp.me/p1fqQ3-2SD 
1;0;0;0;0;Messina - Due anni fa l’alluvione. “Il governo ci ha dimenticato” http://wp.me/p1fqQ3-2Oz 
1;0;0;0;0;Meteora o passione goccia o alluvione Sono io la bianca luna o solo un' illusione chissà se durerò
1;0;0;0;0;Dopo l'alluvione mi consolo con splendide dolcezze (@ Sapori del Lago Nero) http://4sq.com/muoBW8
1;0;0;0;0;Te se recordet Giuan del diluvi Dell' inverno 51/52 Alluvione su tucc i giurnai In Polesine in tucc i edisiun
1;0;0;0;0;un incendio ha fatto iscrivere #Aruba a #twitter chissà cosa succede con un'alluvione
1;0;0;0;0;"avendo analizzato la comunicazione dell'alluvione in Veneto, mi trovo a dire: ""Perché la RAI parla di Calabria-Marche con delle dirette?"""
1;0;0;0;0;Secondo @Il_Centro sarebbe franato un tratto di circa 400 m della Teramo-mare, la superstrada già danneggiata dall'alluvione di aprile 2009.
1;0;0;0;0;eccomi qua in Tv che parlo di alluvione e comunicazione! :) ci vorrebbe tutto un tg.. http://www.tvavicenza.it/a_ITA_2155_1.php
1;0;0;0;0;Alluvione. allerta fino alla notte di Natale. Situazione continuamente monitorata anche a Quarrata http://goo.gl/9pUNN
1;0;0;0;0;Emergenza Alluvione Pakistan Iscos Cisl lancia programma “Cash for Work” http://bit.ly/hvYkUe
1;0;0;0;0;Miracolo alla veneta: alluvione cancellata. http://tinyurl.com/37rfu4t
1;0;0;0;0;Questa scritta è stata esposta stamani in uno dei negozi di Sestri, distrutto dall'alluvione del 4 ottobre. http://twitpic.com/35mmhr
1;0;0;0;0;"in coda per la ""monorazione termosigillata"" sostitutiva della mensa. #Zena #Alluvione http://yfrog.com/7haydvj"
1;0;0;0;0;ottimista (e ironico) si è portato dietro la roba per andare in piscina. Chiusa, ovviamente. #Zena #Alluvione
1;0;0;0;0;La mia fermata... #Zena #Alluvione #AMT http://yfrog.com/ne2mocj
1;0;0;0;0;I nostri eroi escono alla ricerca di un bar funzionante dove pranzare... #Zena #Alluvione
0;0;0;1;0;Varazze zona via via verdi: sono quasi due ore che non c'è elettricità #alluvione
0;0;1;0;0;Alluvione? Di certo è piovuto parecchio (e ancora non smette): http://wp.me/p8b90-32M
0;0;0;0;1;http://twitpic.com/2un98r - Alluvione a Genova: macchine accatastate in via merano /2
0;0;0;0;1;http://twitpic.com/2un8zr - Alluvione a Genova: macchine accatastate in via Merano
0;0;0;0;1;Causa frane e allagamenti servizio irregolare in tutta la città. #Zena #AMT #Alluvione
0;0;0;1;0;Via Siffredi allagata. #Zena #Alluvione http://yfrog.com/28kzij http://yfrog.com/jpj2rbj http://yfrog.com/5961613326j
1;0;0;0;0;"“Gli esseri umani preferiscono pensare in termini di storie piuttosto che di fatti, numeri, equazioni. Ma in un mondo alluvionato da informazioni irrilevanti, la lucidità è potere"". Stasera ho riletto le parole di Yuval Harari e le ho postate sul mio blog …https://giampaolocolletti.nova100.ilsole24ore.com/2020/02/25/in-un-mondo-alluvionato-da-informazioni-la-lucidita-e-potere/ …pic.twitter.com/LxcgZgatS8"
1;0;0;0;0;#allertameteoPIE Sono iniziati oggi i lavori di ripristino dei terrapieno del sottopassaggio alluvionato della sp 181 di collegamento tra Castellazzo B.da e Casalcermelli. pic.twitter.com/hon1Gv5HKa
1;0;0;0;0;Vi tirò un po’ su il morale alluvionato, tanto arriverà pure qui un po’ d’acqua non so quando ma ve lo farò sapere pic.twitter.com/0U4GF8dUS0
1;0;0;0;0;“In un mondo alluvionato da informazioni irrilevanti, la lucidità è potere” (Yuval Noah Harari)
1;0;0;0;0;Modulo autoprotezione in ambiente alluvionato finito... giornata intensa ma davvero... https://www.swarmapp.com/c/b74gBbAzoMN pic.twitter.com/3mpCUYwRac
1;0;0;0;0;marchetta di 2 ore con volo di stato fiorentino coniglio paura esser contestato da chi alluvionato? #genova reagisci http://m.ilsecoloxix.it/p/genova/2015/04/13/ARgSVZ7D-ripartire_bisagno_secolo.shtml …
1;0;0;0;0;Un buongiorno alluvionato! #hosonno pic.twitter.com/uk3G8SjNKC
1;0;0;0;0;#ilcalcioèdichiloama @CriHabets #Telecomitalia devolve tutta la sua campagna di Natale per il rifacimento di un campetto alluvionato #Genova
1;0;0;0;0;#Montoggio un aiuto per il paese alluvionato @ Montoggio Genova http://instagram.com/p/u2n0RHRD1n/ 
1;0;0;0;0;"@Ritzrove giusto! Peccato che in #vallescrivia 0 ""punti vendita"" eppure #montoggio è alluvionato #noncefangochetenga vero @robertocosta_ge ?"
1;0;0;0;0;Sono un alluvionato del cazzo
1;0;0;0;0;La #Nazionale a #Genova non la voglio...Non voglio una solidarietà falsa che io alluvionato devo pagare. #AlluvioneGenova
1;0;0;0;0;Tenta rapina a negozio alluvionato poi si getta nel fiume in piena. Arrestato napoletano http://www.leggo.it/NEWS/ITALIA/genova_napoletano_getta_fiume_per_fuggire/notizie/952062.shtml …
1;0;0;0;0;“ @ErasmoDAngelis: Sorvolo #Gargano alluvionato con #Renzi e sottosegretario @LottiLuca . In elicottero protciv pic.twitter.com/vJjGW9DsgG”
0;0;0;0;1;buongiorno #mattinieri del paese alluvionato franato terremotato e derubato. Ora le cavallette? Ah no... le abbiamo gia' .
1;0;0;0;0;#maltempoER i #vvff di #Venezia inviati a #Modena sono specialisti di interventi in ambiente alluvionato. Già impiegati in Veneto e Toscana
1;0;0;0;0;Anche nel paradiso delle 5 terre noi @paolabellotz ci siamo ed a Vernazza ristrutturato il punto vendita alluvionato! pic.twitter.com/YJQctURHv0
1;0;0;0;0;Comunque i pantaloni risvoltati non ti rendono figo, per niente. Semmai alluvionato.
1;0;0;0;0;“ @FranFerrante #VITAnonprofit:<Lo Stato ci ha abbandonati http://ow.ly/g446j  presidente Misericordie,alluvionato:Siamo stati abbandonati»”
1;0;0;0;0;Rigutino, c'è anche il gattino alluvionato http://va.newsrepublic.net/s/hNdrsU 
1;0;0;0;0;Il mio era uno cercare scambio di informazioni, alla fine io godo 3 mesi all’anno, voi 9 . Alcuni pensano sia il mese in cui nasce a determinare la sopportazione, altri sono fattori genetici, forse di abitudine, a Genova l’inverno è terribile, ventoso, gelido e alluvionato.
1;0;0;0;0;In un mondo alluvionato da informazioni, la lucidità è potere. Yuval Noah Harari, 21 lezioni per il XXI Secolo https://twitter.com/Casellabooksweb/status/1109451149835407360 …
1;0;0;0;0;. @Gianpymalatesta: Domani alle Primarie del CentroSinistra gesto di solidarietà al nostro territorio alluvionato http://fb.me/3omdQ8R5R 
1;0;0;0;0;TAEYANG SEMBRI UN ALLUVIONATO CON I CAPELLI,COSÍWNAJXK
1;0;0;0;0;Ivano Frisina il fango lo conosce bene Alluvionato due volte: nel 94 ad #Alessandria, nel 2014 a #Chiavari @la_stampa http://www.lastampa.it/2014/11/13/edizioni/alessandria/alessandria-chiavari-io-alluvionato-due-volte-vi-spiego-come-si-sopravvive-al-fango-qVMLSmE0Cwf6XLrTviUvNL/pagina.html?utm_source=dlvr.it&utm_medium=twitter …
1;0;0;0;0;Baldo alluvionato non resta con le mani in mano ma si mobilita che nemmeno la protezione civile. #alluvionepic.twitter.com/mQZKQzmXKf
1;0;0;0;0;Chiudono gli argini,si preparano a sacrificare qualche comune per salvare #Padova come nel 2010? #allertafiumipd poi arrangiati alluvionato!
1;0;0;0;0;#romasottacqua e il mondo ne parla. Quando 2 anni fa, mezzo #Veneto era alluvionato tutti sempre a parlare di Roma...sotto 10 cm di neve
1;0;0;0;0;Certo che qui non ci si annoia mai: Vai a dormire alluvionato e ti svegli terremotato! Evvivaaaaaaaaaa
1;0;0;0;0;Hai le Hogan? Sei alluvionato! pic.twitter.com/JPjIbMOxEJ
1;0;0;0;0;Stringate, risvolto da alluvionato, camicia da taglialegna, parka, shopper, occhiale da intellettuale e barba da martire. Sì, sei hipster
1;0;0;0;0;Bertolaso si considera alluvionato come quelli colpiti dalle catastrofi! E Rutelli lo sostiene!!!
1;0;0;0;0;Pronto per giocare #quasi #alluvionato pic.twitter.com/jZJKkpQ
1;0;0;0;0;Tutti hanno la foto de Ponte Milvio alluvionato... Tranne te e me
0;0;0;1;0;Perché ci sono tre metri di marciapiede asciutto in mezzo a tutto il resto che è alluvionato? O.o #mistero #giacobbodovesei
0;0;0;1;0;"@Martolilla96 eh ho capito!ma le strade so tutte simili!Poi sn sbucata in una ""Strada chiusa per ponte alluvionato"" e ho sudato freddo."
1;0;0;0;0;Ma gli sms solidali servono veramente? Come alluvionato dello scorso novembre non ho visto un euro...anzi adesso iniziano le spese!
1;0;0;0;0;@sarofiorello Saro perchè non porti Pistarino alla tua ultima puntata? È un ligure alluvionato ma ha sempre battute fortissime! :D
1;0;0;0;0;Non smettete di aiutare la gente delle #5Terre e dello #Spezzino Alluvionato. Un pensiero e un aiuto al 45500 con un sms.
1;0;0;0;0;Straordinario!!! Quel diluvio universale, verso la fine del video, è una ferita al cuore. #facciamorete #parlodarte #arteeffimera #Divulgo #piaceribrevihttps://twitter.com/JacopoVeneziani/status/1231304243946164225 …
1;0;0;0;0;#13dicembre Poco prima che si scateni il diluvio ... il palazzo è il solito buon pomeriggio #scorcetticapitolini #roma #rome #romeisus @SandroBrizzola4pic.twitter.com/H56P27TMv6 – presso Corte di Cassazione
1;0;0;0;0;Da una parte un diluvio di nuovi Titoli di Stato e la banca centrale che toglie liquidità. Dall'altra sempre meno Titoli di Stato sicuri e la banca centrale che aggiunge liquidità. Risultato: un casino. Sia di qua che di là. https://twitter.com/econopoly24/status/1204386702669815809 …
0;0;1;0;0;Sotto il diluvio, ma #Milano non si lega! Manifestazione in corsopic.twitter.com/v0PnD42ggp
1;0;0;0;0;#Sardegna #Sulcisiglesiente #2novembre Oggi dopo un diluvio, il sole ha fatto il suo miracolo regalandoci questo tramonto. Buona serata a tutti. pic.twitter.com/BXp5PPItF4 – presso Fontanamare Spiaggia
1;0;0;0;0;Mi immagino i vari figli della pioggia nostalgici dell'autunno tazza di tè maglione di lana tutti a ballare per strada sotto il diluvio come in Step Up
0;0;1;0;0;È venuto giù un diluvio assurdo. Quelli in spiaggia così pic.twitter.com/bBuRMpjay2
0;0;1;0;0;Sapiiiiinda...Sapiiiiindaaaa...! Davanti a #LaPerla anche oggi #9luglio col diluvio dajje tutta ragazz@! @filctemcgil @cgilnazionale @rassegna_it @RadioArticolo1 @SusannaCamussopic.twitter.com/GirZuv6LWP – presso La Perla Global Management
1;0;0;0;0;LUIGI XV DOPO DI NOI IL DILUVIO - Di Maio avverte: “Se cade il Governo tornano i tecnici” pic.twitter.com/QuXe9ihDzn
1;0;0;0;0;Sii il mio mare e il mio porto, la mia patria e il mio esilio, sii siccità e diluvio, sii la dolcezza e la durezza. Nizar Qabbani by Lisa #VentagliDiPorti #VentagliDiParole @VentagliPpic.twitter.com/z9Vm1kll7t
1;0;0;0;0;Francamente pensavo che quando il movimento 5stelle ha varato l’Arca per mettere in salvo i gli italiani da questo diluvio di corruzione,ladrocinio,Mafia e degrado etico e morale,si presentasse la maggioranza degli italiani,non è successo.Ancora tanti sguazzano bene nel torbido !
1;0;0;0;0;Quando inquadrano tutta l'Arena mi viene spontaneo pensare che eravamo lì pochissimo tempo fa, sotto un diluvio...d'Amore, perché è stata una serata davvero magica, esattamente come solo lui sa essere #MengoniMusicAwards2019
1;0;0;0;0;Mi chiederai qual è la ragione del mondo. I miei pensieri sono ancora lì, all'Arena pienissima per @mengonimarco nonostante il diluvio. Un concerto memorabile #MengoniLive2019 #BuonaDomenicapic.twitter.com/foAWlkRoSk
1;0;0;0;0;#raceforthecure2019, una bella e partecipata manifestazione per sostenere la lotta ai tumori al seno. Anche sotto il diluvio noi ci siamo ... @UILofficial @UILTECNAZIONALE #unitisiamopiufortipic.twitter.com/gr6sh3wm7u
1;0;0;0;0;”Ho appena letto Notre-Dame,due belle scene,tre parole davvero inverosimili,due descrizioni,la bella e la bestia,e un diluvio di cattivo gusto-una fiaba senza possibilità,noiosa,piena di pretese architettoniche –frutto di un amor proprio eccessivo” Balzac #LeggoHugo #SaLaLetturapic.twitter.com/rfQyDUpYkH
1;0;0;0;0;- Due autobus troppo pieni per salire - auto del car sharing noleggiata ma vandalizzata, quindi abbandonata - città bloccata da internazionali di tennis e finale coppa Italia. >>> a piedi per 6km sotto il diluvio. Muoversi a #Roma: il tuo eroismo quotidia
1;0;0;0;0;Giustamente sto a casa una settimana e fanno 89 gradi, poi esco e c'è l'apocalisse con annesso diluvio universale. #tantolove
1;0;0;0;0;Filippo Palizzi(1818-1899) #Scuolanapoletana: Il diluvio e Gli animali lasciano l'Arca-Monte Ararat #bibbia Nottepic.twitter.com/6M5wHEeJYm
0;0;1;0;0;Quinto al Mare (Ge), la mareggiata e il diluvio universale, live pic... pic.twitter.com/SCnuMhuUal
0;0;0;0;1;#allertameteoPM qui é notte. Diluvio continuo fulmini e tuoni senza sosta con vento fortissimo. Isolati. pic.twitter.com/ZAc0UrbHux
0;0;1;0;0;Stamattina match amichevole, sotto il diluvio, con i ragazzi. Mamma mia quanto sono migliorati, sono felicissimo! #18gennaiopic.twitter.com/wFyz1GYvct
1;0;0;0;0;Maggio mi ha riportata dove ho lasciato il mio nel 2016, a Verona. Ero lì per Marco,con le mie amiche,per il mio compleanno. Primo concerto sotto il diluvio,eppure il più bello ed emozionante di sempre. Che darei per ritornarci #AtlanticoRewind pt8 @mengonimarcopic.twitter.com/hw9X5ZoyvT
1;0;0;0;0;E buong...ci siete?Buona domenica tuider!(Anche se qui ha fatto il diluvio universale e sembra ancora che venga giù il cielo)vabbè...caffè???Quanti siete? pic.twitter.com/2crPdTXTrK
1;0;0;0;0;#allertameteo dopo la tempesta e il diluvio su #Roma la #lunapiena spunta fuori #venerdi13 non è bello @3BMeteo @TrastevereRM @teatrolafenice @SaiCheARoma @romewise @f_girasole @claviggipic.twitter.com/uhjbY2NQwm
0;0;1;0;0;Passeggiata sotto il diluvio fatta...papy ora dovresti asciugarmi baugrazie #Jackgrifopic.twitter.com/s1HKUuVijX
1;0;0;0;0;Mica vorrete perdervi @FrancescaSbard1 e me con i capelli post diluvio...vero? Vi aspettiamo tutti! pic.twitter.com/Lor7050FXc
1;0;0;0;0;Domani a Roma è previsto diluvio all day long. Siete pronti alla guerra? In quale altra città del mondo occidentale le previsioni meteorologiche rappresentano - per la mobilità - il discrimine tra una faticosa routine e...l’apocalisse? #meteo #coraggio
0;0;1;0;0;Sotto il diluvio chi ci doveva essere...IO...olè...che belli i capelli lisci...una goduria veramente .....mare mareeeee
1;0;0;0;0;Di notte diluvio e mattino sole e aria fresca... ...Settembre ti vuoi fidanzare con me?
1;0;0;0;0;Guarda, Alberto, la risposta sta in quel diluvio di pagine su Hitler che abbiamo viste insieme in questi giorni: Hitler non fece altro che portare a termine un lavoro iniziato da altri. Erano in molti a volere governi indipendenti dalla maggioranza parlamentare. È il sogno anche
1;0;0;0;0;Capito perché sta venendo giù il diluvio universale? pic.twitter.com/vxuIH2n7Nr
1;0;0;0;0;Buongiorno a tutti, dopo il diluvio di questa notte, il cielo si è rasserenato e stamattina ci tocca la spiaggia del principe pic.twitter.com/SWR9DxFczt – presso Porto Cervo
0;0;1;0;0;Sveglia dalle 3, diluvio, lampi e tuoni. Acqua ovunque. Si prospetta una grandissima giornata.
1;0;0;0;0;Quando il diluvio ci minaccia, non bisogna temere di bagnarsi i piedi. (Anton ?echov) #UnFiorePer #CasaLettori @CasaLettoripic.twitter.com/UvFXuY4o79
0;0;1;0;0;Sotto un diluvio primaverile ecco finalmente arrivare il mio biglietto per il #PiuCheLogicoTour di @CremoniniCesare !pic.twitter.com/rZLPSlQeeZ
0;0;1;0;0;Oggi sotto il diluvio... Prima @ElenaBerlato ed io 3º. Grazie a tutti #alé #yellowfluorange #unavitaabloccopic.twitter.com/9gcuv7ERey
0;0;0;0;1;qua la situazione sta degenerando cob #pompieri annessi #isola #seveso #maltempo #milano il giorno del #diluvio pic.twitter.com/mewbhmroSw
0;0;1;0;0;il ruggito del vento nel buio totale di un diluvio infinito... pic.twitter.com/f3XtOWYYFY
0;0;1;0;0;E che palle co sta 'bomba d'acqua'. Ma acquazzone? Temporale? Diluvio? No eh, troppo banale
