Oggi lanciamo l'hashtag #iniziaqui  per sensibilizzare a non gettare rifiuti in terra che  attraverso i tombini e i canali di scolo  finiscono nei fiumi e nei laghi  inquinando le nostre acque. Scendiamo in strada e dipingiamo i tombini! Il #lago inizia qui! #trasimenopic.twitter.com/cFuEnJlW4l,NonPertinente
Io sono per la vecchia scuola. Acqua acidulata sul fuoco. La porto poco prima del bollore. Genero un vortice. Getto l'uovo  e l'albume si avviluppa adeguatamente da solo  grazie al movimento dell'acqua. Appena l'albume è rappreso a sufficienza  riprendo e scolo.,NonPertinente
è più facile che abbia lo scolo o problemi alla pompetta idraulica che si è fatto mettere al pisello che non problemi di cuore ecco,NonPertinente
@byb80 hai controllato nel canale di scolo? pic.twitter.com/xjmp3giP1W,NonPertinente
Stanotte sognero' Bossetti che corre dietro ai conigli in un campo di fascette vicino ad un canale di scolo #chilhavisto,NonPertinente
@Losille_ brava. Barolo d'annata te lo scolo tutto e canti in armeno,NonPertinente
Io non lo so se riesco a reggerlo un altro capodanno da single con tutte le coppie che si baciano alle 00:00 mentre mi scolo lo spumante,NonPertinente
@grigiestanze @marcimarti17 io infatti prima scolo il tonno poi ci metto dell'extravergine decente. A volte un pó di peperoncino.,NonPertinente
Il sindaco  esperto di canali di scolo ma anche di metereologia. #chilhavisto,NonPertinente
@ladymorningcake @AratAlina @serena_michieli io  in mutande e canotta mi scolo la seconda birretta sul divano. #fantozzistyle,NonPertinente
Attente ragazze  vi scolo tutte. Come la pastasciutta,NonPertinente
Dopo la terza proiezione tiro fuori dal frigo il succo di melograno e uva rossa  e me lo scolo tutto.,NonPertinente
Vabbuono. Nada Morfeo. Mi scolo boccetta di robba farmaceutica Ecchecaxxo.,NonPertinente
Scolò.mpg: http://youtu.be/QJZf6LxNVUA  @__miana,NonPertinente
@gianpaolagreco @valerialomuzio @lifesfrancy me la scolo quando il partito degli esaltati scende al 5%,NonPertinente
A voi che sgarrinate nel pavimento dell'autobus spero vi venga lo scolo,NonPertinente
Mi scolo 20 litri di birra ed entro in coma etilico,NonPertinente
“@katiaV72: @PastaZalla @FedericaFade66 si...si..arrivooo ...:))”. Anxia da matti. Scolo boccetta lexotan. ^___^,NonPertinente
@Danco85 @LorisCastagnini  super tassa sul gelato  si paga la tassa sullo scolo  leccate leccate Bene,NonPertinente
È da stamattina che sono in giro  non ne posso piu. Stasera a cena fuori  mi scolo una bella birra,NonPertinente
Già mi immagino il concerto. Sono già in fila per le 3 birre che sicuramente mi scolo per fomentarmi di più,NonPertinente
@MCogoli @a_ferrarese @BioSoilExpert Vi vorrei far vedere le sponde dei ns fiumi e canali di scolo,NonPertinente
Sono talmente solo che ho imparato a farmi compagnia da solo A rassegnarmi sono stormi di oche grigie che mi scolo come divinità egizie,NonPertinente
Penso alle mie amiche quando metto il sale nell'acqua e quando scolo la pasta. Se mi vedessero mi picchierebbero. Scusatemi ogni giorno,NonPertinente
Al terzo bicchiere di terre brune finalmente arriva il gol della #JuveCopenaghen almeno non mi scolo la bottiglia :),NonPertinente
Statale-fiume '45!si può pensare d incentivare l'entroterra?ci voleva molto a pulire i tombini e canali di scolo? #Liguria @claudioburlando,NonPertinente
Appena esco da matematica  alle 4  mi concedo al massimo 20 minuti di riposo  poi mi scolo una caffettiera e poi studio.,NonPertinente
Oggi io e mia mamma siamo salite dal canale di scolo per arrivare in cima ad una collinetta ahahah #vaimamii,NonPertinente
#Bari dopo acquazzone si presenta così: Via Napoli principale arteria cittadina... Dove sono i tombini di scolo? pic.twitter.com/AQHU3un4F7,Strutturale
"Corchiano Parco delle Forre  la vecchia ""volica"" ovvero una via di scolo per il canale della centrale… http://instagram.com/p/e5C7Rnyojh/ ",NonPertinente
"Ovviamente ogni volta che mio papà mi dice ""franci avvertimi quando sono passati dieci minuti che scolo la pasta"" mi dimentico  è automatico",NonPertinente
Mettiamo musica per rallegrarci durante lo scolo delle monster per tirare fino a domani e che parte dallo shuffle ? She will be loved.,NonPertinente
compagni di scolo.,NonPertinente
"#SanremoNews Sanremo: lettore segnala: ""E' stata asfaltata una griglia di scolo acque piovane"" http://dlvr.it/3nfYqZ ",NonPertinente
Io  mio padre e due colleghi ci siamo fatti 2 birre diviso 4...che me ne faccio di un bicchiere di birra quando la sera me ne scolo 2 dà 66?,NonPertinente
Compagni di scolo. #cinemalattie,NonPertinente
@NelliFra @nicolelughi il bicchiere lo vedo sempre vuoto.. Ci credo me lo scolo!! Ahaha certo  le amiche di sbronza son sempre bene accette,NonPertinente
Io mi scolo questo  per mandare giù questi 3 gg di cibo aghaha #machebontà @AmorosoOF @MarroneEmma pic.twitter.com/Pc8WylpS,NonPertinente
Mentre nessuno mi guarda mi scolo lo spumante  è molto buono,NonPertinente
“ @larenait: Lo scolo Canossa è tracimato Residenti a casa in gommone http://fb.me/1oUb6gZj8 ” impressionante! @carloguappo @_funkylucky_,NonPertinente
@violalaviola a 12 scolo. (Non serve che ti dica da dove scrivo)  -),NonPertinente
@DomenicoDascola Era un sogno.Ora su svegliati e torna in sala d'aspetto.La bottiglia me la scolo io.Non vorrei ti riaddormentassi di nuovo.,NonPertinente
E dopo la pubblicita'della Marcuzzi e il suo bifidus la tizia col prurito intimo..a quando il tizio con lo scolo? #pubblicita'progresso,NonPertinente
Punto 8 odg consiglio comunale torrile Scarsa manitenzione del Canale di scolo nelle vicinanze del cimitero di san polo approvata,NonPertinente
Ma se io mi scolo una bottiglia di Coca dopo mi devo rilavare i denti ve'?,NonPertinente
Ho ancora il tempo per un bicchiere. Nel frattempo mi scolo la bottiglia,NonPertinente
Questo è il secondo che mi scolo oggi @ Stazione di Pavia http://instagr.am/p/LiojVSmrS4/ ,NonPertinente
Damien rice   se vieni a Roma io mi scolo una bottiglia di vino,NonPertinente
Mi scolo shottini di sciroppo per la tosse Rock n roll babe,NonPertinente
@ChiamalaDani no tu portami un'intera bottiglia da un litro e io la scolo alla goccia e forse così non mi trasformo!,NonPertinente
Le papere e lo scolo @ lungomare minori http://instagr.am/p/I_SoJ/,NonPertinente
Oi oi la copisteria lenta… mi son svegliato assetato… appena arrivo all uni mi scolo qualcosa!,NonPertinente
Il mio geniale canale di scolo *.* ne sono molto fiero http://twitpic.com/3w2zne ,NonPertinente
Se riesco a finire il lavoro prima del 4 crash mi scolo un grappino per festeggiare.,NonPertinente
Caol Ila Distillers Edition tu me provochi?e io te scolo... http://myloc.me/djNtc,NonPertinente
Sguisciano via  mentre le scoli  mentre le condisci e soprattutto mentre le hai in bocca e tenti di masticarle,NonPertinente
Ok digli che son cotti e che scoli gli altri. https://twitter.com/sfaccimmone/status/1229140370518401024 …,NonPertinente
Posso auto-invitarmi? Porto il vino  due bottiglie che so già che una te la scoli tu da solo,NonPertinente
Che dubbi amletici Don.... Ti bendi gli occhi  cambi un po' di volte le posizioni dei bicchieri e poi tiri ad indovinare qual è quello che hai assaggiato per primo... Dopo di che ti scoli 3 bicchieri x tipo. Per non fare dei torti......,NonPertinente
Meglio le alici! Le sardine di mare basso si nutrono degli scoli delle fogne.,NonPertinente
Sciacquati la bocca coglione  prima di parlare di noi calabresi   veni ca’ ca ti sciali e ti acimu vidira duva su i scoli  ti passamu a disciplina,NonPertinente
Ho detto a mia mamma che per cena volevo farmi il riso bollito È andata avanti tutta la pausa pranzo a dirmi “sai che il riso bollito si fa come la pasta no? Poi lo scoli come la pasta e metti il burro come nella pasta” Mamma non sono così tarda so farmi un riso bollito,NonPertinente
Quando vai a cena fuori e nessuno beve vino.. e te ti scoli una bottiglia di Ribolla..ed ovviamente esci ovale..,NonPertinente
...Macini il pepe (rigorosamente da macinare al momento  e rigorosamente nero)  scoli la pasta  aspetti un minutino pure li che si freddi quindi mischi in ciotola.,NonPertinente
Non è la notte a portare consiglio  ma quello che ti scoli prima di andare a dormire.,NonPertinente
Quando frulli gli spinaci ma non scoli tutta l'acqua...e ti ritrovi con la canotta a pois verdi. Ah anche il mobile e le piastrelle ora hanno sfumature verdi. Fine.,NonPertinente
Valentina è arrivata veramente alla frutta  si sta allenando per non lasciare scoli Daniele e Taylor. Menomale che lo zerbino era Martina #gf16pic.twitter.com/WffkQuBCBz,NonPertinente
Se non la scoli tutta  un bianchino me lo farei.,NonPertinente
Quando scoli la pasta ed è nebbia davanti a te #GrowingUpWithGlasses,NonPertinente
Io tengo a cuore gli ultimi neuroni buoni cerco calma negli scoli di peroni,NonPertinente
. @GabrielePersi beh fino a che ti lavi i capelli con la vodka... chissà cosa succede se ti scoli la bottiglietta dello shampoo... #occhio!,NonPertinente
Che brutto quando scoli la pasta e ti si appannano tutti gli occhiali,NonPertinente
@francescapaola3 @luca_tetta Se ti scoli tutta la bottiglia diventa una differenza!!! Cioè il cervello ti abbandona!!!,NonPertinente
È dura alzarsi quando ti scoli un intera bottiglia di #buonvino mammamia #andiamoalavorare!pic.twitter.com/q8HqoYKVsB,NonPertinente
@RobertoTatankaa azzo  e come scoli! o_O,NonPertinente
Secondo me se non ti scoli una bottiglia di vino nello studio di #domenicaIN non entri,NonPertinente
Terme che furono  ove giacciono in silenzio in vecchi scoli  muchi di raffreddati del… https://www.instagram.com/p/BdxYNYpjSKG/ ,NonPertinente
Attenta a non bruciarti quando la scoli Fammela te no?,NonPertinente
Capisci che qualcosa non va quando i tuoi coinquilini si fanno la cioccolata calda e tu ti scoli da solo una bottiglia di vino,NonPertinente
Se tornato a casa ti scoli l'acqua di cattiveria puoi affermare di aver passato una bella serata in compagnia dell'alcol.,NonPertinente
Partenza sotto il diluvio! Piscine non strade  invece che rotonde o tangenzialine sarebbe meglio sistemare gli scoli dell'acqua... #buondì,Strutturale
Com'è che gli spaghetti quando li metti a bollire sembrano sempre pochi e poi quando scoli la pasta si sono moltiplicati?,NonPertinente
Io tengo a cuore gli ultimi neuroni buonu cerco calma negli scoli di Peroni dimentico i nomi,NonPertinente
E non mi fa nemmeno twittare  cioè ci mette scoli per inviare il tweet...,NonPertinente
ma chi era beddu stancanelli  chi anchi pi na piogghia chiureva tutti i scoli,NonPertinente
Ecco cosa si scopre quando tolgono l'acqua dagli scoli.... Incredibile! @ Bonelli http://instagram.com/p/fX1r9lyXlR/ ,NonPertinente
@piciolaceci prrrrr poi mi scoli tutto!!  -),NonPertinente
Non so se sia giá ora di cena o ancora aperitime o come si dice per essere fescion? #apericena? Ti scoli una bottiglia mangiando patatine,NonPertinente
@zaynsdreams SCOLI NELL'ALDILÀ I DEFUNTI AHAHHAHAHAHA SEMPLICE LA COSA AHAHHAHAHAHA,NonPertinente
@zaynsdreams AHAHAHHAHAHAHAHA IO HO LE MIE ARMI  TU SCOLI E IO FACCIO CREPARE LA GENTE DALLE RISATE AHAHAHHAHAHAHAHA*si strofina le mani*,NonPertinente
Spero che la prossima birra che te scoli sia piena d'acido  sto drogato demmerda  #matuzalem la prossima rissa te devono asporta la giugulare,NonPertinente
Signore  fa che questo ragazzo si scoli da me e la smetta di rompermi le palle,NonPertinente
e non è detto che là non mi scoli un po' di redbull,NonPertinente
"#xf5 domanda per elio:""Scommetto che alla fine degli spot il cynar te lo scoli tutto te. Non è vero?""",NonPertinente
"Queste belle persone si auguravano che la sindaca @virginiaraggi non emanasse alcun blocco  nonostante l'allerta meteo ""arancione"" della protezione civile  così se fosse successa una disgrazia  avrebbero ballato come sciacalli sulle vittime  per solleticare il loro ego @ODG_CNOGhttps://twitter.com/bravimabasta/status/1205469250250575873 …",NonPertinente
La tempesta è arrivata... La Raggi con un allerta meteo arancione (allerta diramata dalla regione) non poteva sottrarsi nel chiudere le scuole... pic.twitter.com/DclUpKfeGV,NonPertinente
Autostrada Torino-Savona: Non so chi sia quest'uomo con le mani alzate...sicuramente dobbiamo ringraziarlo per aver evitato una possibile nuova tragedia. #allertameteo #viadotto #altare #Savonapic.twitter.com/Pw8CoRddkA,NonPertinente
Quando scopri che le infrastrutture che hai costruito per un modello di mobilità non durano per sempre  quello è il momento di mettere in discussione il modello di mobilità per cui le hai costruite. La notizia: http://www.savonanews.it/2019/11/24/mobile/leggi-notizia/argomenti/cronaca-2/articolo/crolla-viadotto-della-a6-tra-savona-e-altare.html … #allertameteo #FermiamoStaPagliacciata,NonPertinente
L’Italia  così fragile  devastata da incuria  da speculazioni  da cemento selvaggio  da corruzione  da assenza totale di capacità di pianificare a medio e lungo termine.... Va in pezzi! Eventi estremi dovuti a #EmergenzaClimatica amplificano tutto. Dolore e rabbia #allertameteo https://twitter.com/emergenzavvf/status/1198597008577171456 …,NonPertinente
Crollato un viadotto sull'A6  pare che l'ennesima frana si sia portata via la pila che lo reggeva. Riaprite subito #ItaliaSicura  questo paese cade a pezzi! @GiuseppeConteIT @nzingaretti @matteorenzi #AllertaMeteoLIG #allertameteo #allertaROSSApic.twitter.com/D6jrG68t3X,Strutturale
+++ CROLLATA UNA PARTE DI VIADOTTO SULLA A6 SAVONA TORINO  NEI PRESSI DI ALTARE +++ I Vigili del Fuoco stanno già intervenendo e tra poco anche noi saremo sul posto. #altare #savona #autostrada #liguria #allertameteo #allertameteoligpic.twitter.com/cnmFBh,Strutturale
#allertameteo CROLLATO PONTE SULLA TORINO-SAVONA Ci giunge questa foto da Altare (Savona) dove una parte di viadotto è crollato !!! pic.twitter.com/67zaeXfcZx,Strutturale
Riceviamo una segnalazione e pubblichiamo: AVVISO - FRANATO IL TRATTO DI STRADA SP9 CHE COLLEGA #MONASTERACE (R.C.) A #SERRASANBRUNO (V.V.). MASSIMA PRUDENZA #AllertaMeteo #Calabria pic.twitter.com/Tg2wNz3f7Q,Strutturale
Rinviate le riunioni nelle province di #Taranto  #Brindisi e #Lecce  a causa dell'allerta meteo. Facciamolo sapere a tutti. Le riunioni naturalmente cercheremo di recuperarle al più presto. #M5S #Puglia #Mottola #SanVitoDeiNormanni LEGGI QUI: https://bit.ly/2rop63a pic.twitter.com/zn68TlPIT4,NonPertinente
Situazione a #ReggioCalabria   #allertameteo in tutta la #Calabria. #BuonaDomenica se così possiamo dire per sdrammatizzare...pic.twitter.com/ZuWb448xhL,NonPertinente
Manovra  ex Ilva  Trenta  sardine  Usa  Iran: le parole del 19-11. Alle 23 #Skyline con @giopank @AlbMagna17 @marinacalculli (da mezzanotte #SerieA) + aggiornamenti meteo causa allerta rossa in sei regioni. pic.twitter.com/W6DGIWzQGP,NonPertinente
MALTEMPO : PROLUNGATA SINO ALLE ORE 18 ALLERTA METEO ARANCIONE A GENOVA ! Nel Capoluogo Ligure resistono i torrenti che hanno raggiunto il primo livello di guardia. Esondano alcuni rii con il fango che invade le strade della città ( video da canale meteo WhatsApp) pic.twitter.com/HzFfbHffov,NonPertinente
#Skyline in onda a mezzanotte oggi con aggiornamenti maltempo e allerta meteo  questione Ilva post incontro sindacati-Mattarella  Silvia Romano  Hong Kong  Usa (con @giopank live) e mini rassegna. #Skytg24pic.twitter.com/0uo56k3WJy,NonPertinente
#allertameteoFVG #Muggia AGG 19:15 Al momento nessuna criticità è segnalata sul territorio comunale. permane la chiusura in entrambe le direzioni di via di Trieste per allagamento ricordiamo che siamo in fase di allerta meteo ARANCIONE sino alle ore 12 di domani. pic.twitter.com/QEbQUMflhf,NonPertinente
Ombrone GR è al limite e lo sta superando  purtroppo qua non so davvero come potrebbe andare a fine  stanno evacuando in diverse zone. Fiume Cecina in grossa piena e stanno evacuando persone. Arno che continua a salire in maniera molto forte. #allertameteo,NonPertinente
Con un po’ di cielo azzurro inizia la nostra giornata tra una marea e una prossima allerta meteo annunciata. Partiamo per il Teatro Del Monaco di Treviso per provare ‘Don Carlo’. Buongiorno  amici! #16novembrepic.twitter.com/RyqfGnsklR,NonPertinente
Gradi 10 pioggia e allerta meteo. Non puoi cambiare le persone ma puoi cambiare il tuo modo di guardarle. #BuongiornoATutti #BuonSabato #cambiamenti #BuonaColazione #gioia pic.twitter.com/dNR5wZfJyf,Strutturale
Russiagate e la verità di Conte  la guerra in Siria  i (non) diritti dei migranti  il settimo gg di protesta in Libano  nuove allerta meteo e altre news: alle 23 c'è #Skyline con @fcancellato @giopank @alesansoni e altri ospiti. (sì  a mezzanotte i gol di champions con @fezanca)pic.twitter.com/fmuogqOPja,NonPertinente
buona allerta meteo a tutti pic.twitter.com/eMf5Qkk5sQ – presso Pizza a Taglio Ricciardi,NonPertinente
Adesso è tutto chiaro #allertameteo pic.twitter.com/8MLHixPtpe,NonPertinente
Vi parlo da esperta di Allerta Meteo  qui ce n’è una a settimana. Non credo che i cimiteri siano chiusi “per nn far M0rir3 i mOrty ihihih”  non so da voi ma qui sono pieni di vecchietti che ogni giorno prendono un autobus e si avventurano per rendere omaggio ai loro cari.,NonPertinente
L’ennesima tragedia sfiorata dimostra l’inadeguatezza della classe politica che non ha tutelato e non tutela i cittadini. Chiediamo da tempo un Piano di manutenzione diffuso per infrastrutture e il riorientamento dei fondi per la loro messa in sicurezza. #crolloA6 #AllertaMeteo,Strutturale
ALLERTA METEO IN #LIGURIA: PIOGGIA E NEVE SU CENTRO REGIONE  MASSIMA ATTENZIONE Anche stamattina continua a piovere sulla Liguria  nevica nell’entroterra e sulle alture tra Genova e Savona  ma per fortuna al momento... Leggi tutto qui https://www.facebook.com/giovatoti/photos/a.1420354864878556/2480737162173649?type=3&sfns=mo … #allertameteo pic.twitter.com/Q7AAYgntps,NonPertinente
#ScuolaNormale di #Pisa pericolo di acqua alta anche in biblioteca dove gli studenti mettono salvo i libri. #allertameteo https://twitter.com/scuolanormale/status/1196077903710162951 …,NonPertinente
Domenica pomeriggio in sala montaggio per #PoveraPatria. Vi aspettiamo domani sera in seconda serata su @RaiDue Naturalmente non mancherà l’agenda di #AlessandroPoggi @AnnalisaBruchi @a_g_giuli #politica #Economia #ilva #Venezia #allertameteo pic.twitter.com/QHYNPN1G3F,NonPertinente
Forza #Venezia  forza #Veneziani. Oggi giornata orribile  in peggioramento  con pioggia e #AcquaAlta eccezionale. Amici ristoratori ed esercenti: DURI I BANCHI! #allertameteo #meteo #maltempo #venice #duribanchipic.twitter.com/8ptXBQhROA – presso Venezia,NonPertinente
Chi se ne frega dell allerta meteo.. Io esco #ciaopic.twitter.com/1kxeNhSxA0,NonPertinente
#PLInforma #AccadeOra: causa ALLERTA METEO restano chiusi il Parco Ducale e la Cittadella. Inoltre  sono state rinviate alcune manifestazioni previste per la mattinata: il mercato dei fiori in strada Farini  la biciclettata Bimbinbici e la camminata alla fattoria di Vigheffio. pic.twitter.com/XeQq8CYUmJ,NonPertinente
"Mio nipote  il mini-interista di 8 anni  ha scoperto oggi di avere la sua prima partita di calcio""ufficiale"" domenica Domani non va a scuola  chiusura per allerta meteo  ma ha detto che si sveglierà presto ugualmente perché deve allenarsi per la partita",NonPertinente
Quanto ne sai dell'allerta meteo? Ne parliamo con la protezione civile di Sesto @PCSesto al @CentroSesto ipercoop @unicoopfirenze Come funziona il sistema  i rischi  i colori  ma anche le incertezze del meteo e limiti del sistema. #allertameteo #WorldMetDay #WorldWaterDaypic.twitter.com/5ZDWmPItG8,NonPertinente
Rosso di sera  bel tempo si spera. A sette ore dall'inizio della prossima allerta meteo. pic.twitter.com/FyyHfPVCaN,NonPertinente
Allerta meteo 2 dalle 6 di domani mattina su Genova... pic.twitter.com/qffmjbI7mo,NonPertinente
#PeppinoVallone chiudi le scuole perché l'allerta meteo ce l'ho dentro!! #tamblerboi,NonPertinente
Regoliamoci che alle 4.30 c'è allerta meteo  però è bello così moriamo tutti insieme' Antonella ma cosa mi combini,NonPertinente
Se continua a piovere così domenica l'Angelus lo reciterà l'Uomo di Atlantide #Roma #allertameteo,NonPertinente
Causa allerta #meteo le scuole di #Milazzo domani saranno chiuse.L'incontro è annullato @ Lungomare… http://instagram.com/p/vB6WKPp8Jr/ ,NonPertinente
"Il comune di Napoli manda un'allerta meteo di ""criticità idraulica"". Non ho capito se pioverà o se esonderanno i cessi.",Strutturale
"Amore   non usciamo c'é l'allerta meteo ""Ma se c'é un sole che spacca?"" Allerta meteo zanzare Maaandateacaaagareeee pic.twitter.com/trlxtUolzL",NonPertinente
Maltempo  protezione civile: Prosegue allerta meteo  Marche a rischio http://n.mynews.ly/!YB.BeHBZ  via @NewsRepublic,NonPertinente
Allerta meteo per temporali grandinigeni. Osservatorio #meteo Colline Torinesi http://Rivalba.org  #stormchaserspic.twitter.com/JuIaeoHpqn,NonPertinente
Genova  stupenda domenica di sole con 14 gradi e vento leggero sud precede la nuova Allerta meteo di domani dalle 9 pic.twitter.com/NWqH4GmBwu,NonPertinente
Io sono fiduciosa e spero ancora nell'allerta meteo,NonPertinente
Ufficiale domani nel comune di savona le scuole resteranno chiuse causa allerta meteo #grazieprefetto<3<3,NonPertinente
Ennesima allerta meteo. Chissà se per una volta i metereologi la azzeccano sul serio.,NonPertinente
COMUNE DI GENOVA INFORMA ALLERTA 1 METEO DA ORE 15 DI OGGI A ORE 15 DI DOMANI. PRESTARE ATTENZIONE PIOGGE DIFFUSE E POSSIBILI TEMPORALI,NonPertinente
Comune di Genova Protezione Civile CESSATA ALLERTA METEO permane lo stato di ATTENZIONE fino alle ore 18.00 di domani,NonPertinente
@micky_genova @Miss_S_Fletcher @danielecingano Mi arrendo all'evidenza: allerta meteo di venerdì 17 e' roba da veri #gufometeo as @LuxGandi,NonPertinente
ciaooo amicici sono a casa nonostante la pioggia e l' allerta meteo qui tutto ok,NonPertinente
No ma comunque si preannuncia una bella festa veramente eh  venerdì 17 e allerta meteo 2 #megliodicosi #sapevatelo #perdire,NonPertinente
"doppia Allerta in Regione Liguria...Allerta meteo e Allerta politici ""spendaccioni""... #quandolealluvionivengonobene",NonPertinente
quest'allerta finisce in bellezza #allertameteo pic.twitter.com/hviRyeTPq5,NonPertinente
E il naufragar m'è dolce in queste pozzanghere... #allertameteo,NonPertinente
Quando c'è un'allerta meteo è compito anche del cittadino mettere in sicurezza sè e le sue cose  a mio parere #allertameteoSAR @indivanados,NonPertinente
Allerta meteo  io credo in te,NonPertinente
#Buongiorno a tutti. Oggi c'era allerta meteo soprattutto per la parte orientale della #Sicilia. Per adesso solo bel tempo. Ma sento tuoni..,NonPertinente
Allerta meteo a Roma: bevete tanto  mangiate tanta frutta e portate i vecchi al supermercato 23 gradi a Novembre so troppi!!!,NonPertinente
Diffondete: l'hashtag su Twitter per l'allerta meteo Piemonte è #allertameteoPM sta funzionando molto bene grazie a tutti RT @QuotidianoPM,NonPertinente
#SanremoNews Badalucco: allerta meteo  le immagini di una lettrice sulla situazione del torrente Argentina http://dlvr.it/ttnwx ,NonPertinente
Attenzione allerta meteo dalle 13 per il Veneto! https://twitter.com/ilmeteoit/status/133123032138002432 …,NonPertinente
#SanremoNews Allerta meteo: situazione del torrente Argentina  le foto di un lettore scattate da veri punti http://dlvr.it/ttj2g ,NonPertinente
“ @ComunediGenova: Allerta meteo 2 prorogata fino alle 18 di domani su tutta la Liguria” #allertameteoLG,NonPertinente
#SanremoNews Ceriana: allerta meteo  il sindaco Bruna Rebaudo fa il punto della situazione http://dlvr.it/ttFjT ,NonPertinente
Allerta meteo prorogati fino alle 18 di domani. Mi auguro per prudenza. Oggi non sta accadendo nulla ma siamo stanchi. #piovesullaliguria,NonPertinente
“ @erapisardi: @MicheledAlena @giovanni_arata tutte le strade portano in rete. maltempo si sposta verso toscana. #allertameteo #TOS”,NonPertinente
Scusate il cinismo  ma è una settimana che c'é l'allerta meteo in Liguria  ma ndo cacchio dovete andare? Ma state a casa!,NonPertinente
@AlbeSp84 porca troia...!!!!! l avevano detto ke l allerta meteo s era spostata dall altra parte...ormai da noi verranno 2 gocce...,NonPertinente
Buongiorno a tutti. Allerta meteo in Liguria. Attenzione.,NonPertinente
@guidomeda sono più per l'allerta meteo,NonPertinente
Beeeeello abitare attaccati al fiume quando c'è allerta meteo!!!!!!!!,NonPertinente
Inizia a piovere...allerta meteo!!! Dai Liguria resisti!!! (@ Jack's Office) [pic]: http://4sq.com/sa0Bnl ,NonPertinente
“@repubblicait: Ultime ore di caldo  arriva l'autunno Allerta meteo in varie regioni http://bit.ly/qeoAL9 ” @nadiaplasti giu acqua!!,NonPertinente
Allerta meteo per il caldo fino al 29  poi la svolta http://wp.me/p1fqQ3-2ld ,NonPertinente
ALLERTA METEO: tromba Marina in Corsica!!! #fb,NonPertinente
24h di allerta meteo per temporali localmente violenti e grandiniferi. Attenzione !!! Validità milanese e Brianza --,NonPertinente
21 Aprile Allerta meteo sulle Isole maggiori http://wp.me/p1fqQ3-zu,NonPertinente
@iacoale83 no qui è andata! Il meteo dice allerta per oggi  ma penso che ormai sia andata... Voi ci siete dentro!,NonPertinente
Buongiorno  allerta meteo fino a domani alle 12 ed io sono già fuori di casa.,NonPertinente
“Piove sul giusto e piove anche sull'ingiusto  ma sul giusto di più  perché l'ingiusto gli ruba l'ombrello.” [Charles Bowen] #giornatamondialegiustiziasociale #20febbraio #thinkdifferent #SocialJusticeDaypic.twitter.com/pUKNL84RX7,NonPertinente
