In un articolo del corriere sui danni delle eliche sui fondali della laguna viene riportata anche la fotografia del fondale di Riva di Biasio  dove a causare gli scavi sono i vaporetti. Altra cosa curiosa una struttura simmetrica sommersa (freccia rossa). Un'antica fondamenta ? pic.twitter.com/aavJQpu26T,NonPertinente
Giornaloni & Controinformazione Fubini  vicedir. del @Corriere  confessa di aver nascosto la notizia dei bimbi morti in Grecia: “morti 700 neonati in più per la crisi. Ma ho nascosto la notizia”. Scriveva Seneca che la verità  anche se sommersa  viene presto o tardi a galla. pic.twitter.com/zJlNGSjb9C,NonPertinente
Vado a dormire con @AmorosoOF che  sommersa da bambini  mi riempie il cuore di gioia e pensando che sia proprio nata per dare amore (e per fare la mamma).,NonPertinente
"Marco Cattaneo (National Geographic): ""Per l'aumento della temperatura potremmo perdere entro questo secolo parte della pianura padana  che andrebbe sommersa: poi avremmo un fenomeno molto interessante: i migranti cliamatici padani"". #DiMartedì",NonPertinente
Quando vi ritrovate ad avere la testa sommersa di pensieri   fate due semplici cose : andate sul vostro letto e chiudete gli occhi. Funziona,NonPertinente
Italia sopravvive perché ha tre economie: una reale  una sommersa 35% del Pil e una criminale 200billion€ via @FT Financial Times @59Gian,NonPertinente
Ci stanno facendo schifare della giustizia  facendoci mettere nel calderone anche quella che lavora in silenzio  senza telecamere  sommersa da fascicoli che mai verranno smaltiti appieno  quella che scava nei meandri della criminalità e del malaffare  quello vero!,NonPertinente
niente raga  faccio una pausa dallo studio  vado a cazzeggiare un po’ su instagram e anche lui  grazie ai suoi filtri  mi ricorda che quest’anno sarò sommersa dai libri perché ho la maturità. grazie mille ora torno a studiare (strano vero?) #maturita2020pic.twitter.com/fPAqk5FNr5,NonPertinente
Una foto per sostenere #Venezia  la città di mio padre  sommersa in questi giorni da #acquaalta e preoccupazione. È un ritratto fatto da @stefanoscata per il mio libro Celebrate in Venice. Sono al caffeflorian in… https://www.instagram.com/p/B4-2DQ6nwrE/?igshid=30d3498t3zeh …,NonPertinente
In un albo di Nathan Never (vedi quanto sto vecchia) c'era proprio questo tema  della Venezia salvata  ma sommersa - adagiata sul fondo del mare. Erano delle tavole magnifiche... non mi chiedere in che volume... non lo ricordo assolutamente.,NonPertinente
#Venezia sommersa da 183 cm di mare. Fiumi d'acqua anomali fra i sassi di #Matera. Emergenza mal tempo e disastri ovunque. Ma stiamo tranquilli ché tanto farfallina81  su Facebook  ha detto che i #cambiamenticlimatici non sono un'emergenza e #Greta è pilotata dai genitori.,NonPertinente
una città sommersa dai rifiuti una città con trasporti indegni e che prendono fuoco una città al buio una città piena di buche una città che si allaga a ogni temporale una città in cui vengono giù alberi e lei la sindaca... balla Mah! #commissariateroma,NonPertinente
Io lo amo questo ragazzone  ma chi glielo spiega che è dall'alba che son sommersa di tweets?!! https://twitter.com/stevevicrn/status/1188906926576414721 …,Strutturale
Condannati i genitori di Renzi per fatture false. Vi rucordate? In merito a febbraio Renzi attacco'la Procura dicendo che la sua famiglia non sarebbe stata sommersa dal fango se lui non avesse fatto politica,NonPertinente
Gli italiani sono troppo poveri  ma spendono 100 Miliardi di euro all'anno in scommesse e lotterie. Ne evadono altrettanti in lavoro nero e mancate fatture. L'economia sommersa e pari a 210 miliardi nel 2018. Io comincio ad avere dubbi sulla reale povertà in Italia.,NonPertinente
Non solo questo. Video e foto di Roma sommersa dalle immondizie hanno girato il mondo e più di qualcuno penserà che tutta l'Italia è ridotta così. E tutte le altre quotidiane notizie su come è combinato questo povero Paese..... #FR14giugno,NonPertinente
Ciao carissima  se chiudo gli occhi penso di aver sognato di essere stata a Roma  ma io l'ho vista cosi con il cielo grigio e sommersa dalla gente. Un pensiero per te. Un grande abbraccio Manuela pic.twitter.com/Lyue4Ze13b,NonPertinente
@BrindusaB1 buona serata io sono sommersa dalle notifiche! @mamisblu @emanuelaneri14 @circeanna @battiata62,NonPertinente
Città sommersa @846dc2c8308740a @canzonixvoi @alexa24988 @AndreaNessi1 @TrueColours8pic.twitter.com/VfhJtwGBEt,NonPertinente
Ma io dico  la mia vita sociale che fine ha fatto? Sono sempre sommersa dallo studio #nonsipuò,NonPertinente
"Remember when ""la prossima canzone è per mio fiiiiilio"" a roma e boh son sommersa dai feels ok riportatemi lì tipo ora",NonPertinente
La pressione fiscale in italia è al netto dell'economia sommersa pari al 53  2%. In Francia è al 49 5% e in Danimarca del 51 3%,NonPertinente
Sommersa da puntate di teletilm da vedere  ma io posso vivere con st'ansia addosso?,NonPertinente
Chiesa sommersa nel lago di Resia  Val Venosta  Trentino Alto Adige pic.twitter.com/l0NLcD9NAg,NonPertinente
cioè ma ci pensate di nuovo ai pomeriggi in cui alle cinque è buio e la scrivania sommersa da libri? oddio,NonPertinente
Il tempo che passa non mi fa particolarmente piacere ma è bellissimo essere sommersa di affetto così... #grazie,NonPertinente
@emyellowagron mmm okay..stasera provo(?)e ti dico se ho dormito xD hahahah poi la mattina dopo mi risveglio sommersa dai libri:CHE INCUBO!,NonPertinente
Sono sommersa dai compiti. Latino  greco  inglese  matematicaaaaa. Aiutate una povera crista,NonPertinente
ho sognato che milano veniva sommersa da un'alluvione e che eravamo invasi dagli orsi mannari. LOL,NonPertinente
Maledizione  sono sommersa da manga e libri! pic.twitter.com/ov5kw1cx8y,NonPertinente
@69Haribo_ awww mi spiace!! Io sono sommersa dai compiti cwc,NonPertinente
Sta entrando la @juventusfc sommersa dai fischi !,NonPertinente
La mia adorata città sommersa dall' acqua a causa dell' alluvione... :'(,NonPertinente
Sono sommersa sotto il piumone e penso alle risate delle persone a cui voglio bene. La stranezza a cui ti conduce la febbre,NonPertinente
@BigRedBus5 NE ERO SOMMERSA AHAHAHHAHAHAHA MI HANNO SBALLATO E SONO DIVENTATA UN TUTTUNO HAHAHAHAHAHAHA,NonPertinente
Bersani sui patrimoni. Distinzioni tra patrimoni mobili e immobili  ricchezza sommersa ed evasione. Inutile mettere tasse su chi le paga già,NonPertinente
Primo anno #Monti: +3% debt/GDP ratio  +4% tasso di economia sommersa e buco di 7bln€ nei conti pubblici #grandirisultati #fail #sapevatelo,NonPertinente
@MissRoss83 si ci è mancata @wineup ma è colpa mia che l'ho confinata in ufficio sommersa di lavoro:-),NonPertinente
Studiando studiando e ancora studiando... Non oso immaginare come sarà il mio natale sommersa dai libri #Christmas #study #work,NonPertinente
Attività criminale produce il 12 6% del PIL  economia sommersa é il 18 1% del PIL @pbersani cosa avete fatto fino ad oggi? #1csx2 #csrai,NonPertinente
Sommersa dalle coperte :) #relaxpic.twitter.com/J9pe8op6,NonPertinente
#FF a @LaCapaRouja che sono totalmente convinta si trovi a letto in lacrime  sommersa da coperte e fazzoletti  gelato e cioccolata.,NonPertinente
@MaggyPava anche iooo <3 Però sono sommersa dai compiti che ppalleeeeeeee,NonPertinente
Sommersa di foto e non so quale scegliere.. Sono solo 1600 scatti! Povera me! pic.twitter.com/T7XCIiZZ,NonPertinente
Favorire l'ecommerce è la più efficace e liberale azione di contrasto all'economia sommersa. #ideona @simonespetia @karimlesina,NonPertinente
“ @aspitaleri: #giglio  immagine scattata in mattinata: mezza #costaconcordia è sommersa. #Tragedia pic.twitter.com/BhbPmrqN” minchia!,NonPertinente
Sommersa da presunte querele!! (@ Studio Caniato-Tagliani) http://4sq.com/uUyGLw ,NonPertinente
Stupendo in Inghilterra una cittadina è stata sommersa dalla schiuma naturale ottenuta dalla decomposizione delle alghe http://www.rai.tv/dl/RaiTV/programmi/media/ContentItem-626a5b50-415a-479d-a640-d1609dedaffb-tg1.html …,NonPertinente
2 anni fa e l'anno scorso la toscana era sommersa dalla neve. Feci 2 viaggi della disperazione x andare a roma. #ricordi,NonPertinente
La provincia sommersa dal fango: a Barcellona anche gli atleti diventano volontari. http://wp.me/p1fqQ3-3Bq ,NonPertinente
Chissà se amoSa è ancora sommersa dalle scartoffie ... @SintesiSa,NonPertinente
“ @sudsoundsystem La tv ignora Barcellona Pozzo di Gotto sommersa. Fate girare! RT PLEASE! http://www.youtube.com/watch?v=d6R9YcP5jHw&feature=share …”,NonPertinente
New York  tra 10 anni potrebbe essere sommersa da una «tempesta perfetta» http://www.corriere.it/?from=tw ,NonPertinente
Ho giusto quei 6 numeri arretrati di Vanity Fair. Aiuto! Verrò sommersa dalla mia brama di lettura  me lo sento. #sapevatelo,NonPertinente
@ Roma sposa sommersa di odiosi ragazzini! http://myloc.me/ne8Zp ,NonPertinente
Sono le 9.20 di Lunedì mattina. Ho la scrivania sommersa dalle pratiche. Voglio morì.,NonPertinente
Passerò l'estate sommersa dai gialli di Agatha Christie. Ok  papà  ne ho già letti due  ma non c'era bisogno di comprarne altri SEI. ._____.,NonPertinente
Lotta all'evasione fiscale ed all'economia sommersa: la Guardia di Finanza festeggia il 237° anniversario e traccia… http://wp.me/p1fqQ3-1Do,NonPertinente
Bellaaaa!!! Entro domani Milano sarà sommersa dall'acqua!!! #wow!! Preparo pinne  maschera e boccaglio!,NonPertinente
Credo che morirò sommersa dalle e-mail che sto inviando!!!,NonPertinente
sommersa dai doveri non riesco più a trovare uno spazietto per me... che disdetta essere universitari!,NonPertinente
Italia sempre più sommersa dagli immobili abusivi http://goo.gl/71May,NonPertinente
Speriamo di non trovare la macchina sommersa dalla neve :( (@ Area di Servizio San Martino Ovest) http://4sq.com/c0AyGU,NonPertinente
Buonanotte a tutti! Domani vado a Napoli  che sarà pure sommersa dai rifiuti  ma rimane una delle città più belle al mondo. #vieniviaconme,NonPertinente
Buona giornata da Lucca sommersa! :-(,NonPertinente
Pensa che al termine di quella partita il parcheggio dello stadio si Allago' a tal punto che sommerse di acqua decine e decine di vetture e il comune fu chiamato a un risarcimento Massivo... Quello non fu un furto. No  no  quando i derubati siamo noi non importa,NonPertinente
Periferie sempre più dimenticate. Sommerse dai rifiuti non raccolti. Percorse da urla disperate che nessuno sente in città! (E che io ho imparato a riconoscere  ascoltare  rispettare) #forzanapoli… https://www.instagram.com/p/B7JGc6SIogH/?igshid=157dip21kzbxu …,NonPertinente
Ormai è la normalità: strade allagate  macchine sommerse fino agli sportelli  fiumi d'acqua nella metro A  stazioni chiuse. Di nuovo emergenza maltempo  a pochi giorni dall'ultimo nubifragio. Ecco la piscina della stazione Termini #romatornacapitale @LegaSalvini @matteosalvinimipic.twitter.com/Gohoo9MZOJ,NonPertinente
Così di Roma non rimarranno che macerie sommerse di immondizia  topi  cinghiali e voRaggini sulle strade  a casa #raggidimettiti,NonPertinente
Mi fa arrabbiare che alcune nullità vengano invitate a pontificare in TV. Il dramma é che diamo loro visibilità e invece andrebbero sommerse da tonnellate di indifferenza.,NonPertinente
Oggi parliamo di città sepolte e rovine sommerse a #Ischia  per la rassegna #arkeostoriae @edizionimulino #archeologia #libripic.twitter.com/vnUAXh0w67,NonPertinente
Dave Sommers  ex digital director del primo ministro canadese Justin Trudeau incontra la community di comunicatori e giornalisti di #pasocial : come usare Instagram per la pubblica amministrazione e i governipic.twitter.com/F50uWwPFbF,NonPertinente
Con le correnti giuste e un po' di fortuna si può trovare questo: con maschera e pinne è divertente girare tutte le antiche peschiere sommerse di Alsium. E poi è pieno zeppo di pic.twitter.com/U3VlTlAeuG,NonPertinente
Prova d'autore per il romanzo che scriverò sui social. Labirinti e vertigini d'anime sommerse. https://twitter.com/MarcelloVitale3/status/1154357985638043650 …,NonPertinente
Eri acqua  e lo sono diventata  dentro di te. Disciolti goccia a goccia  come un solo mare fluttuavi mentre fluttuavo  le mani  la bocca  riportavano insieme. E parti di noi  sommerse dentro un bacio infinito. Eri acqua  lo ero anch’io liquefatti d’amore. Lieta sera Twitterini pic.twitter.com/lwyn0XgcJ1,NonPertinente
Siamo su @ilmessaggeroit con le attività di #archeologia #subacquea del #progettoMUSAS nelle ville sommerse di #Baia :) @_MiBAC #campiflegrei @Saf_ISCRpic.twitter.com/DQhtlrE5pQ,NonPertinente
I grandi sono duri....non sentono ...non comprendono...non succede silo con il clima...succede con tante cose importanti che rimangono sommerse io sono con greta...ma volete sentire ? Vi volete svegliare ? Volete rimediare o portarci tutti ad esiti infelici....ne avete respon...,NonPertinente
WOW! Mosaici  marmi  statue del I secolo: #MeraviglieDelSud sommerse a 3-4 metri di… https://www.instagram.com/p/BXpVlTBFaV1/ ,NonPertinente
La letteratura non è una menzogna: ci sono verità sommerse nella finzione Marías al Premio Tomasi di Lampedusa pic.twitter.com/z784x1gQbW,NonPertinente
Le figlie di Marisa sommerse dai panni da stirare. Il video che ha commosso il web. #chilhavisto,NonPertinente
@lollodercole @layura76 @Fra_Ricca le ha sommerse di bombe da tre: vedi che succede a vederti giocare con la Virtus? #staywithus,NonPertinente
Le sommerse la nostra attuale passione! È la vostra? #pescamosca #flyfishingpic.twitter.com/9lPMoVGAqU,NonPertinente
 @R__Rob: Se questo è un premier.... Le Marche sommerse dall'acqua e #Renzie sorridente allo stadio... pic.twitter.com/4UKUoL97bq SCHIFOSOOO,NonPertinente
Bagnara  un chilometro di case abusive sommerse dal #mare http://buff.ly/13P6VRJ  @ Castel Volturno http://instagram.com/p/dal5b2BcqH/ ,NonPertinente
Su twitter per essere accettato o lecchi il culo o hai un cazzo la sotto in caso contrario sarai sommerse di critiche e pregiudizi.,NonPertinente
5 anni???? Maldive già sommerse!!!,NonPertinente
Roma  e tutto il sud Italia sono sommerse dai rifiuti  e il Presidente della Regione Lazio @nzingaretti accetta un accordo al ribasso con i 5S che prevede il NO a nuovi inceneritori. Quello che state facendo è incomprensibile e surreale. @pdnetwork un sussulto di dignità.,NonPertinente
Purtroppo tutte i figli delle mie amiche e colleghe sono sommerse dai compiti. Tutti alle scuole medie. Credo che i professori siano più incentrati sui programmi da fare che sugli alunni. D’altronde non è colpa loro  ci sono i programmi ministeriali da seguire,NonPertinente
Sì  è sempre bello credere ai miti  alle saghe e alle leggende  le sirene  le polene  i vascelli fantasma... le città sommerse e sai quante ce ne saranno ancora da esplorare!,NonPertinente
Il piacere di bagnarsi sulle colonne romane sommerse al mare. #portocesareo #italy #puglia #mediterranean #romanruins #heritage #columns #colonne #romanempire #vacances #holidays #estiu… https://www.instagram.com/p/BnGo9mrninj/?utm_source=ig_twitter_share&igshid=1ojrryl553l88 …,NonPertinente
[...]Loro erano al tavolino del bar  sommerse da buste  borse  carica batteria volanti e… https://www.instagram.com/p/BE53fY6oXiP/ ,NonPertinente
Alluvione in Costa Azzurra: Nizza e Cannes sommerse  almeno 12 morti.,NonPertinente
#SanremoNews Diano Marina: domani prima conferenza sulle meraviglie sommerse del mare del ponente ligure http://dlvr.it/8Nc5HH ,NonPertinente
@Paolo_Foschi Genova e la Liguria sommerse....niente di nuovo  purtroppo.,NonPertinente
@DottorWatson @Luka1961 Vero...anche le tracce residue sono state sommerse dai gomblotti,NonPertinente
"@Divino_2 io adesso mi addormento sul divano mentre il kapo guarda ""Vite sommerse"" su Real Time.",NonPertinente
Le case semi-sommerse danno un aspetto spettrale e macabro a questo lago. pic.twitter.com/C53wSTMkmG,NonPertinente
Lido Krimisa .. bagno tra rovine greche sommerse dal mare #magnagrecia (@ Lido Poseidon) https://www.swarmapp.com/folghera/checkin/53ff0e71498e742e3bb6b0b3?s=asQI0TmW9_Q_m8WZcOOzmauQX40&ref=tw …pic.twitter.com/DdZpRByCvp,NonPertinente
@tommy300898 Le tavole della legge sommerse da fiumi di nuove leggi pure disattese!,NonPertinente
E mentre #Sardegna e #Calabria sono sommerse dall'acqua governo delle #largheintese di . @EnricoLetta pensa alla #Cancellieri #Follies2013,NonPertinente
la volitiva e ispirata antipatia della sciura milanese che si muove nella zona1 non conosce pari tra le zone emerse e sommerse #sapevatelo,NonPertinente
@_xHope_99 @yoyo_tommo ah... uffa fede il prossimo anno tocca anche a noi D: se ci fossero alle medie noi ne saremmo sommerse  ),NonPertinente
Due larve spiaggiate sul letto/divano sommerse da sushi pop corn e Lindt bianco ai frutti rossi a guardare #tvoi @TataMoiJeJoue #friends,NonPertinente
#sce2012 @letizia_m_ presenta @kilowattBo un cluster e uno spazio d co-progettazione per energie sommerse,NonPertinente
Itinerario nelle Isole minori della Laguna  emerse e sommerse. Qui è Burano e stiamo andando verso @ Burano http://instagr.am/p/I3oj56JL40/ ,NonPertinente
Itinerario nelle Isole minori della Laguna  emerse e sommerse. Il chiostr @ Isola San Francesco Del Deserto http://instagr.am/p/I2c9hcpL1J/ ,NonPertinente
tinerario nelle Isole minori della Laguna  emerse e sommerse. Ecco l @ Chiesa di Santa Caterina di Mazzorbo http://instagr.am/p/I2cKDqpL09/ ,NonPertinente
Muore un vip e troviamo bacheche sommerse di post al riguardo. Muoiono 22 bambini e quelli che commentano si contano sulle dita di una mano!,NonPertinente
A otto giorni dall'alluvione sono moltissime le attività ancora in ginocchio  sommerse dal fango. [pic]: http://4sq.com/w70LLp ,Strutturale
Habe gerade die erste Minirockträgerin dieses Sommers gesichtet. #wettertweet,NonPertinente
@iJacquess ach  du vielleicht!!!^^ ich bin ein Kind der Helligkeit  des Sommers und der Sonne...,NonPertinente
Mi sembra di conoscerle:-) “ @sylvanerHof: Viti per metà sommerse... http://twitpic.com/8enoe9 ”,NonPertinente
Le #marche sommerse dalla #neve: i militari in aiuto dei cittadini? Pagare! http://www.ilfattoquotidiano.it/2012/02/06/marche-lesercito-interviene-spalare-neve-pagare/189376/ …,NonPertinente
@Reba91 Ahahah!!!graaazieee 1000!!!x] lunedì!!!(se non moriamo prima sommerse dallo studio!!!xD),NonPertinente
@GNUAqualcosa Ciao Cvimella :) Anche io e @Kikka_1002 siamo sommerse dalla neve :D Oggi bigiata collettiva :),NonPertinente
@MattuGiuliana Da noi è nevicato a 30 km .. Le autostrade sono sommerse dalla neve .. :-),NonPertinente
imprenditori che si suicidano perché le loro aziende sono sommerse dai debiti. mi dispiace per loro e famiglia ma per me sono solo codardi,NonPertinente
@7RED_ROSES #NF #F4F???? @followygor @Peppermintsnap @romeolove143 @yungbrooklyn125 @cyntiaalexandra @mimirosa9 @IMMI999 @candy_sommers,NonPertinente
#Roma sottopassaggio viale Marconi completamente allagato. Macchine sommerse,Strutturale
Protesta feroce degli abitanti del quartiere Santa Maria Goretti. Case sommerse dall'acqua. Aeroporto in tilt !!,NonPertinente
Die letzten Heuarbeitrn dieses Sommers http://twitpic.com/6sb4dq ,NonPertinente
Tieni in casa il mister muscolo granulare  costa sui 2€ al supermercato  lo versi nello scarico (sembra tipo sale grosso)  intanto fai bollire l'acqua dopo di che la versi nello scarico e ti si sturano le tubature!! Io lo uso molto per la doccia!!,NonPertinente
Scuola Aldo Moro devastata dai vandali È la seconda volta in una settimana. Rotte le tubature e le vetrate. Scuola allegata e inagibile http://www.frosinonetoday.it/cronaca/frosinone-scuola-aldo-moro-devastata-vandali.html …pic.twitter.com/lNgvnovmSY,NonPertinente
"Amministratore condominio....""tranquilli le tubature sono a posto"" pic.twitter.com/bOVJbghoj1",NonPertinente
LAVORI ALLE TUBATURE nella frazione di Bagnaia causeranno un colore simpatico all'acqua. Niente di preoccupante. Secondo le analisi DELL' ARPAT  non è letale. L'inconveniente durerà poche ore. pic.twitter.com/wFfZzuQaaw,Strutturale
Ho avuto ora terribili notizie su #Zintan. I rifugiati riescono a rubare un po' di acqua da bere solo dalle tubature e solo la mattina  quando le guardie aprono l'acqua per loro. Cibo zero. I malati di TBC sono più di 70. Sul pavimento. Orrore totale.,NonPertinente
A #Milano si spreca pochissima #acqua  grazie alla fibra ottica nelle tubature. Questa è solo una delle innovazioni introdotte da @comunicazionemm: siamo alla Centrale dell’Acqua per assistere alla presentazione del libro #Innobook che le racconta tutte. http://life.gt/innobook pic.twitter.com/EricbBMryA – presso Piazza Diocleziano,NonPertinente
Io sono una testimone vivente di tutto ciò. Cinisello B.è una città popolata da emigranti e all'inizio non è stato facile x nessuno.Portavo da cena a due poveri cristi che dormivano nelle tubature delle fogne vicino ad una casa in costruzione.Rammendavo... https://twitter.com/ummiririnenti/status/1109113052803289088 …,NonPertinente
Spogliatoio dell'Inter spaccato ? Cosa si e' rotto ? Le tubature idrauliche   le doccie non funzionano o la parte centrale dello spogliatoio ? Che e' il cesso,NonPertinente
@AMAP_Palermo Perdita tubature acqua Sferracavallo prontamente risolta. Grazie! pic.twitter.com/8rqWEfrXsC,NonPertinente
"Non hai pulito il bagno! Non collabori mai! ""Mamma  non è come sembra. Nelle tubature. C'è un Basilisco."" ""..."" ""..."" #WeNeedHarryPotterGO",NonPertinente
Per vedere #EclissiSolare dovete rompere le tubature del cesso chiamare lo stagnino farvi prestare sue lenti da saldatore alle 9.25 precise.,NonPertinente
Come tenere l'impianto sotto controllo. Proteggi #tubature #valvole #filtri #addolcitori ed… https://instagram.com/p/0VQyM4Do0W/ ,NonPertinente
#giornatadellaguida #genova: antiche tubature per l' #acqua sotto le mura del barbarossa @agtliguria #VieniaGenovapic.twitter.com/jeEdDcI3vI,NonPertinente
@SenzaProvince sostituite le tubature usurate del liceo che determinavano una perdita di pressione e di calore l'impianto dovrebbe,NonPertinente
Stasera si doveva digiunare. Invece sono stati cucinate persino le tubature dei sanitari alla griglia. #santostefano,NonPertinente
Muratori rompono le tubature al 7° piano. Qui al 5° inizia a gocciolare PIPÌ. Bestemmio coppie di santi 3 a 3. Non vengo pagato abbastanza.,NonPertinente
Tra poco Checco che aggiusta le tubature del lavandino con la cocaina! AHAHAHAHAHAHAHAHAHAHAHAHAHAHAHAHAHAH STO GIÀ RIDENDO! #cadodallenubi,NonPertinente
La paura di andare in bagno e trovare #Giacobbo che ispeziona le tubature. #Voyager,NonPertinente
Complimenti al tifoso colombiano che aveva i denti con più piombature delle tubature di casa mia. #BrasileColombia,NonPertinente
Prima che risolva i problemi della scuola che risolva i problemi delle tubature cit.,NonPertinente
Attraverso l'uso di fibre ottiche è possibile monitorare strutture come ponti  tubature della rete idrica e fognaria  argini dei fiumi  sopraelevate. Vuoi saperne di più? Ci trovi a @SmartCityNow1! #monitoraggioinfrastrutturalepic.twitter.com/2ydhgKfVnX – presso Cassina Triulzia,NonPertinente
Tubature romane di piombo. A parte ammirare la bellissima scrittura dei romani  ma non ne rimanevano avvelenati? https://twitter.com/Roman_Britain/status/1163714932942282752 …,NonPertinente
Tenetelo buono che può sempre servire quando si intasano le tubature ...,NonPertinente
c’è stata una tromba d’aria e pioggia e colava l’acqua fin nel supermercato perché ha rotto delle tubature....,NonPertinente
Andare in banca a chiedere un prestito  occuparsi delle finanze domestiche  di un guasto alle tubature. Quelle responsabilità che nessuno ti insegna ad affrontare e ti piovono addosso all’improvviso. #Buffy,NonPertinente
Mah  se uno ha qualche dubbio circa la qualità delle tubature - sacrosanto - si può installare un filtro a casa ed è fatta. Ma darsi all'acqua minerale mi è sempre sembrata una GROSSA esagerazione  anche io vado di lavandino.,NonPertinente
Sono scoppiate le tubature  esce acqua dal soffitto e tutto il corridoio è allagato HAHA,NonPertinente
E PERCHÈ MANCA L'ACQUA? SI SONO CONGELATE LE TUBATURE! MA SCHERZIAMO?,NonPertinente
#legionella #leiene da domani facciamo analizzare tubature di casa e ci scordiamo le docce nei circoli sportivi....addio proprio,NonPertinente
Andare a scuola e scoprire che é chiusa per la rottura delle tubature idrauliche #gioiedellavita #soloalgullace,NonPertinente
Mmmm Acqua di doccia l'unico deodorante rinfrescante e profumato i Acqua di doccia by Tubature,NonPertinente
Quando dovete mandare individui a casa della gente a controllare le tubature del gas almeno mandateli fighi e che cazzo!,NonPertinente
@ti_melis la settimana scorsa ha piovuto x 1 oretta ma così forte che in 5 minuti sono saltate le tubature e i tombini facevano i gaiser XD,Strutturale
Com'è possibile che un giorno sì ed uno no  ci sia sempre guasto alle tubature?! #Cefalù #rt #Rt GoodMorning #acqua,Strutturale
Ditemi COME CAZZO SI FA a buttare un neonato giu per lo scarico e trovarlo in tubature larghe 10 cm #DITEMICOME,NonPertinente
 Voglio uccidereee  mi pareva il basilisco nelle tubature,NonPertinente
Vigliacca Troia di merda che mi hai punto nella fronte!!! Crepa nelle tubature del cesso pic.twitter.com/UA0wyZ2V97,NonPertinente
Il mio compagno si è arrampicato sulle tubature di un bagno e ha rotto il water LOOOOOL,NonPertinente
"Mia mamma:""io avevo pianto guardandolo tu stai piangendo?"" NO MAMMA CI SONO DELLE PERDITE ALLE TUBATURE. #thelastsong",NonPertinente
“ @1Myone: @bravoAlvin perché il movimento tra qualche ora sarà nelle tubature sotto quelle vie .”Perla di saggezza!!!numer1,NonPertinente
@Simone_Snoopy ma non lo so...mica l'hanno preso...é ancora in giro per le tubature...ohmiodio!! :-0,NonPertinente
