1;0;0;0;0;@BrindusaB1 buona serata io sono sommersa dalle notifiche! @mamisblu @emanuelaneri14 @circeanna @battiata62
1;0;0;0;0;Città sommersa @846dc2c8308740a @canzonixvoi @alexa24988 @AndreaNessi1 @TrueColours8pic.twitter.com/VfhJtwGBEt
1;0;0;0;0;Ma io dico, la mia vita sociale che fine ha fatto? Sono sempre sommersa dallo studio #nonsipuò
1;0;0;0;0;"Remember when ""la prossima canzone è per mio fiiiiilio"" a roma e boh son sommersa dai feels ok riportatemi lì tipo ora"
1;0;0;0;0;La pressione fiscale in italia è al netto dell'economia sommersa pari al 53 ,2%. In Francia è al 49,5% e in Danimarca del 51,3%
1;0;0;0;0;Sommersa da puntate di teletilm da vedere, ma io posso vivere con st'ansia addosso?
1;0;0;0;0;Chiesa sommersa nel lago di Resia, Val Venosta, Trentino Alto Adige pic.twitter.com/l0NLcD9NAg
1;0;0;0;0;cioè ma ci pensate di nuovo ai pomeriggi in cui alle cinque è buio e la scrivania sommersa da libri? oddio
1;0;0;0;0;Il tempo che passa non mi fa particolarmente piacere,ma è bellissimo essere sommersa di affetto così... #grazie
1;0;0;0;0;@emyellowagron mmm okay..stasera provo(?)e ti dico se ho dormito xD hahahah poi la mattina dopo mi risveglio sommersa dai libri:CHE INCUBO!
1;0;0;0;0;Sono sommersa dai compiti. Latino, greco, inglese, matematicaaaaa. Aiutate una povera crista
1;0;0;0;0;ho sognato che milano veniva sommersa da un'alluvione e che eravamo invasi dagli orsi mannari. LOL
1;0;0;0;0;Maledizione, sono sommersa da manga e libri! pic.twitter.com/ov5kw1cx8y
1;0;0;0;0;@69Haribo_ awww mi spiace!! Io sono sommersa dai compiti cwc
1;0;0;0;0;Sta entrando la @juventusfc sommersa dai fischi !
0;0;0;0;1;La mia adorata città sommersa dall' acqua a causa dell' alluvione... :'(
1;0;0;0;0;Sono sommersa sotto il piumone e penso alle risate delle persone a cui voglio bene. La stranezza a cui ti conduce la febbre
1;0;0;0;0;@BigRedBus5 NE ERO SOMMERSA AHAHAHHAHAHAHA MI HANNO SBALLATO E SONO DIVENTATA UN TUTTUNO HAHAHAHAHAHAHA
1;0;0;0;0;Bersani sui patrimoni. Distinzioni tra patrimoni mobili e immobili, ricchezza sommersa ed evasione. Inutile mettere tasse su chi le paga già
1;0;0;0;0;Primo anno #Monti: +3% debt/GDP ratio, +4% tasso di economia sommersa e buco di 7bln€ nei conti pubblici #grandirisultati #fail #sapevatelo
1;0;0;0;0;@MissRoss83 si ci è mancata @wineup ma è colpa mia che l'ho confinata in ufficio sommersa di lavoro:-)
1;0;0;0;0;Studiando studiando e ancora studiando... Non oso immaginare come sarà il mio natale sommersa dai libri #Christmas #study #work
1;0;0;0;0;Attività criminale produce il 12,6% del PIL, economia sommersa é il 18,1% del PIL @pbersani cosa avete fatto fino ad oggi? #1csx2 #csrai
1;0;0;0;0;Sommersa dalle coperte :) #relaxpic.twitter.com/J9pe8op6
1;0;0;0;0;#FF a @LaCapaRouja che sono totalmente convinta si trovi a letto in lacrime, sommersa da coperte e fazzoletti, gelato e cioccolata.
1;0;0;0;0;@MaggyPava anche iooo <3 Però sono sommersa dai compiti che ppalleeeeeeee
1;0;0;0;0;Sommersa di foto e non so quale scegliere.. Sono solo 1600 scatti! Povera me! pic.twitter.com/T7XCIiZZ
1;0;0;0;0;Favorire l'ecommerce è la più efficace e liberale azione di contrasto all'economia sommersa. #ideona @simonespetia @karimlesina
1;0;0;0;0;“ @aspitaleri: #giglio, immagine scattata in mattinata: mezza #costaconcordia è sommersa. #Tragedia pic.twitter.com/BhbPmrqN” minchia!
1;0;0;0;0;Sommersa da presunte querele!! (@ Studio Caniato-Tagliani) http://4sq.com/uUyGLw 
1;0;0;0;0;Stupendo in Inghilterra una cittadina è stata sommersa dalla schiuma naturale ottenuta dalla decomposizione delle alghe http://www.rai.tv/dl/RaiTV/programmi/media/ContentItem-626a5b50-415a-479d-a640-d1609dedaffb-tg1.html …
1;0;0;0;0;2 anni fa e l'anno scorso la toscana era sommersa dalla neve. Feci 2 viaggi della disperazione x andare a roma. #ricordi
1;0;0;0;0;La provincia sommersa dal fango: a Barcellona anche gli atleti diventano volontari. http://wp.me/p1fqQ3-3Bq 
1;0;0;0;0;Chissà se amoSa è ancora sommersa dalle scartoffie ... @SintesiSa
1;0;0;0;0;“ @sudsoundsystem La tv ignora Barcellona Pozzo di Gotto sommersa. Fate girare! RT PLEASE! http://www.youtube.com/watch?v=d6R9YcP5jHw&feature=share …”
1;0;0;0;0;New York, tra 10 anni potrebbe essere sommersa da una «tempesta perfetta» http://www.corriere.it/?from=tw 
1;0;0;0;0;Ho giusto quei 6 numeri arretrati di Vanity Fair. Aiuto! Verrò sommersa dalla mia brama di lettura, me lo sento. #sapevatelo
1;0;0;0;0;@ Roma sposa sommersa di odiosi ragazzini! http://myloc.me/ne8Zp 
1;0;0;0;0;Sono le 9.20 di Lunedì mattina. Ho la scrivania sommersa dalle pratiche. Voglio morì.
1;0;0;0;0;Passerò l'estate sommersa dai gialli di Agatha Christie. Ok, papà, ne ho già letti due, ma non c'era bisogno di comprarne altri SEI. ._____.
1;0;0;0;0;Lotta all'evasione fiscale ed all'economia sommersa: la Guardia di Finanza festeggia il 237° anniversario e traccia… http://wp.me/p1fqQ3-1Do
0;0;1;0;0;Bellaaaa!!! Entro domani Milano sarà sommersa dall'acqua!!! #wow!! Preparo pinne, maschera e boccaglio!
1;0;0;0;0;Credo che morirò sommersa dalle e-mail che sto inviando!!!
1;0;0;0;0;sommersa dai doveri non riesco più a trovare uno spazietto per me... che disdetta essere universitari!
1;0;0;0;0;Italia sempre più sommersa dagli immobili abusivi http://goo.gl/71May
0;0;1;0;0;Speriamo di non trovare la macchina sommersa dalla neve :( (@ Area di Servizio San Martino Ovest) http://4sq.com/c0AyGU
1;0;0;0;0;Buonanotte a tutti! Domani vado a Napoli, che sarà pure sommersa dai rifiuti, ma rimane una delle città più belle al mondo. #vieniviaconme
1;0;0;0;0;Buona giornata da Lucca sommersa! :-(
1;0;0;0;0;Pensa che al termine di quella partita il parcheggio dello stadio si Allago' a tal punto che sommerse di acqua decine e decine di vetture e il comune fu chiamato a un risarcimento Massivo... Quello non fu un furto. No, no, quando i derubati siamo noi non importa
1;0;0;0;0;Periferie sempre più dimenticate. Sommerse dai rifiuti non raccolti. Percorse da urla disperate che nessuno sente in città! (E che io ho imparato a riconoscere, ascoltare, rispettare) #forzanapoli… https://www.instagram.com/p/B7JGc6SIogH/?igshid=157dip21kzbxu …
0;0;0;0;1;Ormai è la normalità: strade allagate, macchine sommerse fino agli sportelli, fiumi d'acqua nella metro A, stazioni chiuse. Di nuovo emergenza maltempo, a pochi giorni dall'ultimo nubifragio. Ecco la piscina della stazione Termini #romatornacapitale @LegaSalvini @matteosalvinimipic.twitter.com/Gohoo9MZOJ
1;0;0;0;0;Così di Roma non rimarranno che macerie sommerse di immondizia, topi, cinghiali e voRaggini sulle strade, a casa #raggidimettiti
1;0;0;0;0;Mi fa arrabbiare che alcune nullità vengano invitate a pontificare in TV. Il dramma é che diamo loro visibilità e invece andrebbero sommerse da tonnellate di indifferenza.
1;0;0;0;0;Oggi parliamo di città sepolte e rovine sommerse a #Ischia, per la rassegna #arkeostoriae @edizionimulino #archeologia #libripic.twitter.com/vnUAXh0w67
1;0;0;0;0;Dave Sommers, ex digital director del primo ministro canadese Justin Trudeau incontra la community di comunicatori e giornalisti di #pasocial : come usare Instagram per la pubblica amministrazione e i governipic.twitter.com/F50uWwPFbF
1;0;0;0;0;Con le correnti giuste e un po' di fortuna si può trovare questo: con maschera e pinne è divertente girare tutte le antiche peschiere sommerse di Alsium. E poi è pieno zeppo di pic.twitter.com/U3VlTlAeuG
1;0;0;0;0;Prova d'autore per il romanzo che scriverò sui social. Labirinti e vertigini d'anime sommerse. https://twitter.com/MarcelloVitale3/status/1154357985638043650 …
1;0;0;0;0;Eri acqua, e lo sono diventata  dentro di te. Disciolti goccia a goccia, come un solo mare fluttuavi mentre fluttuavo, le mani  la bocca, riportavano insieme. E parti di noi, sommerse dentro un bacio infinito. Eri acqua, lo ero anch’io liquefatti d’amore. Lieta sera Twitterini pic.twitter.com/lwyn0XgcJ1
1;0;0;0;0;Siamo su @ilmessaggeroit con le attività di #archeologia #subacquea del #progettoMUSAS nelle ville sommerse di #Baia :) @_MiBAC #campiflegrei @Saf_ISCRpic.twitter.com/DQhtlrE5pQ
1;0;0;0;0;I grandi sono duri....non sentono ...non comprendono...non succede silo con il clima...succede con tante cose importanti che rimangono sommerse io sono con greta...ma volete sentire ? Vi volete svegliare ? Volete rimediare o portarci tutti ad esiti infelici....ne avete respon...
1;0;0;0;0;WOW! Mosaici, marmi, statue del I secolo: #MeraviglieDelSud sommerse a 3-4 metri di… https://www.instagram.com/p/BXpVlTBFaV1/ 
1;0;0;0;0;La letteratura non è una menzogna: ci sono verità sommerse nella finzione Marías al Premio Tomasi di Lampedusa pic.twitter.com/z784x1gQbW
1;0;0;0;0;Le figlie di Marisa sommerse dai panni da stirare. Il video che ha commosso il web. #chilhavisto
1;0;0;0;0;@lollodercole @layura76 @Fra_Ricca le ha sommerse di bombe da tre: vedi che succede a vederti giocare con la Virtus? #staywithus
1;0;0;0;0;Le sommerse la nostra attuale passione! È la vostra? #pescamosca #flyfishingpic.twitter.com/9lPMoVGAqU
1;0;0;0;0; @R__Rob: Se questo è un premier.... Le Marche sommerse dall'acqua e #Renzie sorridente allo stadio... pic.twitter.com/4UKUoL97bq SCHIFOSOOO
1;0;0;0;0;Bagnara, un chilometro di case abusive sommerse dal #mare http://buff.ly/13P6VRJ  @ Castel Volturno http://instagram.com/p/dal5b2BcqH/ 
1;0;0;0;0;Su twitter per essere accettato,o lecchi il culo,o hai un cazzo la sotto,in caso contrario,sarai sommerse di critiche e pregiudizi.
1;0;0;0;0;5 anni???? Maldive già sommerse!!!
1;0;0;0;0;Roma, e tutto il sud Italia sono sommerse dai rifiuti, e il Presidente della Regione Lazio @nzingaretti accetta un accordo al ribasso con i 5S che prevede il NO a nuovi inceneritori. Quello che state facendo è incomprensibile e surreale. @pdnetwork un sussulto di dignità.
1;0;0;0;0;Purtroppo tutte i figli delle mie amiche e colleghe sono sommerse dai compiti. Tutti alle scuole medie. Credo che i professori siano più incentrati sui programmi da fare che sugli alunni. D’altronde non è colpa loro, ci sono i programmi ministeriali da seguire
1;0;0;0;0;Sì, è sempre bello credere ai miti, alle saghe e alle leggende, le sirene, le polene, i vascelli fantasma... le città sommerse e sai quante ce ne saranno ancora da esplorare!
1;0;0;0;0;Il piacere di bagnarsi sulle colonne romane sommerse al mare. #portocesareo #italy #puglia #mediterranean #romanruins #heritage #columns #colonne #romanempire #vacances #holidays #estiu… https://www.instagram.com/p/BnGo9mrninj/?utm_source=ig_twitter_share&igshid=1ojrryl553l88 …
1;0;0;0;0;[...]Loro erano al tavolino del bar, sommerse da buste, borse, carica batteria volanti e… https://www.instagram.com/p/BE53fY6oXiP/ 
0;0;0;0;1;Alluvione in Costa Azzurra: Nizza e Cannes sommerse, almeno 12 morti.
1;0;0;0;0;#SanremoNews Diano Marina: domani prima conferenza sulle meraviglie sommerse del mare del ponente ligure http://dlvr.it/8Nc5HH 
1;0;0;0;0;@Paolo_Foschi Genova e la Liguria sommerse....niente di nuovo, purtroppo.
1;0;0;0;0;@DottorWatson @Luka1961 Vero...anche le tracce residue sono state sommerse dai gomblotti
1;0;0;0;0;"@Divino_2 io adesso mi addormento sul divano mentre il kapo guarda ""Vite sommerse"" su Real Time."
1;0;0;0;0;Le case semi-sommerse danno un aspetto spettrale e macabro a questo lago. pic.twitter.com/C53wSTMkmG
1;0;0;0;0;Lido Krimisa .. bagno tra rovine greche sommerse dal mare #magnagrecia (@ Lido Poseidon) https://www.swarmapp.com/folghera/checkin/53ff0e71498e742e3bb6b0b3?s=asQI0TmW9_Q_m8WZcOOzmauQX40&ref=tw …pic.twitter.com/DdZpRByCvp
1;0;0;0;0;@tommy300898 Le tavole della legge,sommerse da fiumi di nuove leggi pure disattese!
0;0;0;0;1;E mentre #Sardegna e #Calabria sono sommerse dall'acqua governo delle #largheintese di . @EnricoLetta pensa alla #Cancellieri #Follies2013
1;0;0;0;0;la volitiva e ispirata antipatia della sciura milanese che si muove nella zona1 non conosce pari tra le zone emerse e sommerse #sapevatelo
1;0;0;0;0;"@_xHope_99 @yoyo_tommo ah... uffa fede il prossimo anno tocca anche a noi D: se ci fossero alle medie noi ne saremmo sommerse ;)"
1;0;0;0;0;Due larve spiaggiate sul letto/divano sommerse da sushi pop corn e Lindt bianco ai frutti rossi a guardare #tvoi @TataMoiJeJoue #friends
1;0;0;0;0;#sce2012 @letizia_m_ presenta @kilowattBo un cluster e uno spazio d co-progettazione per energie sommerse
1;0;0;0;0;Itinerario nelle Isole minori della Laguna, emerse e sommerse. Qui è Burano e stiamo andando verso @ Burano http://instagr.am/p/I3oj56JL40/ 
1;0;0;0;0;Itinerario nelle Isole minori della Laguna, emerse e sommerse. Il chiostr @ Isola San Francesco Del Deserto http://instagr.am/p/I2c9hcpL1J/ 
1;0;0;0;0;tinerario nelle Isole minori della Laguna, emerse e sommerse. Ecco l @ Chiesa di Santa Caterina di Mazzorbo http://instagr.am/p/I2cKDqpL09/ 
1;0;0;0;0;Muore un vip e troviamo bacheche sommerse di post al riguardo. Muoiono 22 bambini e quelli che commentano si contano sulle dita di una mano!
0;0;0;1;0;A otto giorni dall'alluvione sono moltissime le attività ancora in ginocchio, sommerse dal fango. [pic]: http://4sq.com/w70LLp 
1;0;0;0;0;Habe gerade die erste Minirockträgerin dieses Sommers gesichtet. #wettertweet
1;0;0;0;0;@iJacquess ach, du vielleicht!!!^^ ich bin ein Kind der Helligkeit, des Sommers und der Sonne...
1;0;0;0;0;Mi sembra di conoscerle:-) “ @sylvanerHof: Viti per metà sommerse... http://twitpic.com/8enoe9 ”
0;0;0;0;1;Le #marche sommerse dalla #neve: i militari in aiuto dei cittadini? Pagare! http://www.ilfattoquotidiano.it/2012/02/06/marche-lesercito-interviene-spalare-neve-pagare/189376/ …
1;0;0;0;0;@Reba91 Ahahah!!!graaazieee 1000!!!x] lunedì!!!(se non moriamo prima sommerse dallo studio!!!xD)
1;0;0;0;0;@GNUAqualcosa Ciao Cvimella :) Anche io e @Kikka_1002 siamo sommerse dalla neve :D Oggi bigiata collettiva :)
0;0;0;0;1;@MattuGiuliana Da noi è nevicato a 30 km .. Le autostrade sono sommerse dalla neve .. :-)
1;0;0;0;0;imprenditori che si suicidano perché le loro aziende sono sommerse dai debiti. mi dispiace per loro e famiglia ma per me sono solo codardi
1;0;0;0;0;@7RED_ROSES #NF #F4F???? @followygor @Peppermintsnap @romeolove143 @yungbrooklyn125 @cyntiaalexandra @mimirosa9 @IMMI999 @candy_sommers
0;0;0;1;0;#Roma sottopassaggio viale Marconi completamente allagato. Macchine sommerse
0;0;0;0;1;Protesta feroce degli abitanti del quartiere Santa Maria Goretti. Case sommerse dall'acqua. Aeroporto in tilt !!
1;0;0;0;0;Die letzten Heuarbeitrn dieses Sommers http://twitpic.com/6sb4dq 
1;0;0;0;0;Tieni in casa il mister muscolo granulare, costa sui 2€ al supermercato, lo versi nello scarico (sembra tipo sale grosso), intanto fai bollire l'acqua dopo di che la versi nello scarico e ti si sturano le tubature!! Io lo uso molto per la doccia!!
1;0;0;0;0;Scuola Aldo Moro devastata dai vandali È la seconda volta in una settimana. Rotte le tubature e le vetrate. Scuola allegata e inagibile http://www.frosinonetoday.it/cronaca/frosinone-scuola-aldo-moro-devastata-vandali.html …pic.twitter.com/lNgvnovmSY
1;0;0;0;0;"Amministratore condominio....""tranquilli le tubature sono a posto"" pic.twitter.com/bOVJbghoj1"
0;1;0;0;0;LAVORI ALLE TUBATURE nella frazione di Bagnaia causeranno un colore simpatico all'acqua. Niente di preoccupante. Secondo le analisi DELL' ARPAT, non è letale. L'inconveniente durerà poche ore. pic.twitter.com/wFfZzuQaaw
1;0;0;0;0;Ho avuto ora terribili notizie su #Zintan. I rifugiati riescono a rubare un po' di acqua da bere solo dalle tubature e solo la mattina, quando le guardie aprono l'acqua per loro. Cibo zero. I malati di TBC sono più di 70. Sul pavimento. Orrore totale.
1;0;0;0;0;A #Milano si spreca pochissima #acqua, grazie alla fibra ottica nelle tubature. Questa è solo una delle innovazioni introdotte da @comunicazionemm: siamo alla Centrale dell’Acqua per assistere alla presentazione del libro #Innobook che le racconta tutte. http://life.gt/innobook pic.twitter.com/EricbBMryA – presso Piazza Diocleziano
1;0;0;0;0;Io sono una testimone vivente di tutto ciò. Cinisello B.è una città popolata da emigranti e all'inizio non è stato facile x nessuno.Portavo da cena a due poveri cristi che dormivano nelle tubature delle fogne vicino ad una casa in costruzione.Rammendavo... https://twitter.com/ummiririnenti/status/1109113052803289088 …
1;0;0;0;0;Spogliatoio dell'Inter spaccato ? Cosa si e' rotto ? Le tubature idrauliche , le doccie non funzionano o la parte centrale dello spogliatoio ? Che e' il cesso
1;0;0;0;0;@AMAP_Palermo Perdita tubature acqua Sferracavallo prontamente risolta. Grazie! pic.twitter.com/8rqWEfrXsC
1;0;0;0;0;"Non hai pulito il bagno! Non collabori mai! ""Mamma, non è come sembra. Nelle tubature. C'è un Basilisco."" ""..."" ""..."" #WeNeedHarryPotterGO"
1;0;0;0;0;Per vedere #EclissiSolare dovete rompere le tubature del cesso,chiamare lo stagnino,farvi prestare sue lenti da saldatore alle 9.25 precise.
1;0;0;0;0;Come tenere l'impianto sotto controllo. Proteggi #tubature #valvole #filtri #addolcitori ed… https://instagram.com/p/0VQyM4Do0W/ 
1;0;0;0;0;#giornatadellaguida #genova: antiche tubature per l' #acqua sotto le mura del barbarossa @agtliguria #VieniaGenovapic.twitter.com/jeEdDcI3vI
1;0;0;0;0;@SenzaProvince sostituite le tubature usurate del liceo che determinavano una perdita di pressione e di calore l'impianto dovrebbe
1;0;0;0;0;Stasera si doveva digiunare. Invece sono stati cucinate persino le tubature dei sanitari alla griglia. #santostefano
1;0;0;0;0;Muratori rompono le tubature al 7° piano. Qui al 5° inizia a gocciolare PIPÌ. Bestemmio coppie di santi 3 a 3. Non vengo pagato abbastanza.
1;0;0;0;0;Tra poco Checco che aggiusta le tubature del lavandino con la cocaina! AHAHAHAHAHAHAHAHAHAHAHAHAHAHAHAHAHAH STO GIÀ RIDENDO! #cadodallenubi
1;0;0;0;0;La paura di andare in bagno e trovare #Giacobbo che ispeziona le tubature. #Voyager
1;0;0;0;0;Complimenti al tifoso colombiano che aveva i denti con più piombature delle tubature di casa mia. #BrasileColombia
1;0;0;0;0;Prima che risolva i problemi della scuola che risolva i problemi delle tubature cit.
1;0;0;0;0;Attraverso l'uso di fibre ottiche è possibile monitorare strutture come ponti, tubature della rete idrica e fognaria, argini dei fiumi, sopraelevate. Vuoi saperne di più? Ci trovi a @SmartCityNow1! #monitoraggioinfrastrutturalepic.twitter.com/2ydhgKfVnX – presso Cassina Triulzia
1;0;0;0;0;Tubature romane di piombo. A parte ammirare la bellissima scrittura dei romani, ma non ne rimanevano avvelenati? https://twitter.com/Roman_Britain/status/1163714932942282752 …
1;0;0;0;0;Tenetelo buono che può sempre servire quando si intasano le tubature ...
0;0;0;0;1;c’è stata una tromba d’aria e pioggia e colava l’acqua fin nel supermercato perché ha rotto delle tubature....
1;0;0;0;0;Andare in banca a chiedere un prestito, occuparsi delle finanze domestiche, di un guasto alle tubature. Quelle responsabilità che nessuno ti insegna ad affrontare e ti piovono addosso all’improvviso. #Buffy
1;0;0;0;0;Mah, se uno ha qualche dubbio circa la qualità delle tubature - sacrosanto - si può installare un filtro a casa ed è fatta. Ma darsi all'acqua minerale mi è sempre sembrata una GROSSA esagerazione, anche io vado di lavandino.
1;0;0;0;0;Sono scoppiate le tubature, esce acqua dal soffitto e tutto il corridoio è allagato HAHA
1;0;0;0;0;E PERCHÈ MANCA L'ACQUA? SI SONO CONGELATE LE TUBATURE! MA SCHERZIAMO?
1;0;0;0;0;#legionella #leiene da domani facciamo analizzare tubature di casa e ci scordiamo le docce nei circoli sportivi....addio proprio
1;0;0;0;0;Andare a scuola e scoprire che é chiusa per la rottura delle tubature idrauliche #gioiedellavita #soloalgullace
1;0;0;0;0;Mmmm Acqua di doccia l'unico deodorante rinfrescante e profumato i Acqua di doccia by Tubature
1;0;0;0;0;Quando dovete mandare individui a casa della gente a controllare le tubature del gas almeno mandateli fighi e che cazzo!
0;1;0;0;0;@ti_melis la settimana scorsa ha piovuto x 1 oretta ma così forte che in 5 minuti sono saltate le tubature e i tombini facevano i gaiser XD
0;1;0;0;0;Com'è possibile che un giorno sì ed uno no, ci sia sempre guasto alle tubature?! #Cefalù #rt #Rt GoodMorning #acqua
1;0;0;0;0;Ditemi COME CAZZO SI FA a buttare un neonato giu per lo scarico e trovarlo in tubature larghe 10 cm #DITEMICOME
1;0;0;0;0; Voglio uccidereee  mi pareva il basilisco nelle tubature
1;0;0;0;0;Vigliacca Troia di merda che mi hai punto nella fronte!!! Crepa nelle tubature del cesso pic.twitter.com/UA0wyZ2V97
1;0;0;0;0;Il mio compagno si è arrampicato sulle tubature di un bagno e ha rotto il water LOOOOOL
1;0;0;0;0;"Mia mamma:""io avevo pianto guardandolo,tu stai piangendo?"" NO MAMMA CI SONO DELLE PERDITE ALLE TUBATURE. #thelastsong"
1;0;0;0;0;“ @1Myone: @bravoAlvin perché il movimento tra qualche ora sarà nelle tubature sotto quelle vie .”Perla di saggezza!!!numer1
1;0;0;0;0;@Simone_Snoopy ma non lo so...mica l'hanno preso...é ancora in giro per le tubature...ohmiodio!! :-0
1;0;0;0;0;@caosnews è agghiacciante. Potrebbero direttamente mettere eroina nelle tubature.
1;0;0;0;0;Il mio oroscopo della gazzetta... tubature suine XD non go paroe XD (@ Bar i Centro) http://4sq.com/qhKXvJ 
1;0;0;0;0;@DiStraforo @sararocutto l'unica è che esplodano le tubature in casa loro per lavarli
1;0;0;0;0;Acqua ovunque. Maledette tubature, maledetto giardiniere!
1;0;0;0;0;@gianpino che hai le tubature intasate, e anche da un bel po', visto che le lumache fanno in tempo a giungere nella doccia piena et perire!
1;0;0;0;0;"@DocThomas comunque qualcosa muove. ancora niente espulsione di gas ma brontolio ""effetto idraulico liquido nelle tubature"". #medicina33"
1;0;0;0;0;Mi si è ghiacciata l'acqua nelle tubature... vi sembra normale?
0;1;0;0;0;@PLRomaCapitale @TrastevereRM @RiprendRoma un tombino quasi compromesso sul #lungotevereaventino si prega di intervenire prima che qualcuno si faccia del male... per favorepic.twitter.com/0rz52cy9Xb
1;0;0;0;0;L #inter prima in classifica. #Lukaku man of the day #icarders chiusi dentro un tombino #Esposito in gol #Sensi in campo La nord che canta #Icardi uomo.di merda. Atalanta-Nilam 5-0 La juve sempre #Finoalconfine Marco Violi capo ultrà neroazzurro. Che cazzo di #Natale amici miei.
1;0;0;0;0;Via Chiana 41- Scavo archeologico rivela un antico tombino. Segnalato ed ignorato. @JimmyGhione @romafaschifo @Antincivili @virginiaraggi che famo?pic.twitter.com/nf033nLijb
1;0;0;0;0;Ma smettila coniglietto, sei stato nelle fogne fino a ieri e adesso fai il duro solo perché un fascista di merda ti ha fatto uscire un po dal tombino. Il fascista di merda è quello che fino a ieri ti chiamava terrone parassita
1;0;0;0;0;Ma la Grauso è una perticona o la cugina di Roberta sta dentro un tombino? #chilhavisto
1;0;0;0;0;"Ritardo. Mi lavo i denti. Dose di collutorio ""da tenere 30 secondi"". Penso: ""Lo sputazzo nel tombino in cortile"". Scendo le scale. Esce la vicina. ""Buondì!"". Decisione tragica: butto giù il collutorio. ""Eh, buondì a lei..."". Mi sento un pino nello stomaco. È tutto grottesco."
1;0;0;0;0;Vi hanno fottuto nuovamente. A risentirci quando gli effetti saranno palesi e voi chiederete più spesa e più debito per uscire dal tombino puzzolente in cui il decreto dei vostri pifferai vi avrà cacciato. Poveri lemming https://twitter.com/GianlucaVasto/status/1144258708488278016 …
1;0;0;0;0;arriverà il momento dell'aumento dell'Iva grazie al quale i voti scapperanno da Salvini LABATE rosicamento udibile sino all'antartide @borghi_claudio @matteosalvinimi mi raccomando ... tenete sempre la foto di Renzi sulla scrivania affinchè non cadiate nello stesso tombino pic.twitter.com/BmustYoHB7
1;0;0;0;0;Manlio Di Stefano da una intervista a La Verità. Tombino contro fogna. Dichiara: Mai alleanze con gli amici di Renzi. Una bellissima giornata, per me.
1;0;0;0;0;Un cardinale si è dunque calato in un tombino per dar la luce ad occupanti abusivi morosi. Siamo tornati ai tempi di La Pira? Ma nessun pasto è gratis. Qualcuno che paga c’è sempre. E non è il Vaticano
1;0;0;0;0;Certi che la sfiga ci vede lungo: il tombino sporgente di Baku è andato a danneggiare in prove libere l’unico team che non ha nemmeno i soldi per costruire i pezzi di ricambio: la Williams #AzerbaijanGP
1;0;0;0;0;Esterno, notte. Via Ponte Calvi. Il cameriere del Savó svuota il posacenere nel tombino. Ho spalato in 2 alluvioni. Due. Alluvioni. I tombini tappati dalle cicche delle sigarette che vi piace tanto buttare per terra. E poi si, sei un maleducato oltre che cretino.
1;0;0;0;0;Noi non facciamo sconti alle mele marce: Sospesi e allontanati dall'azienda. Vi ricordate gli incivili di cui vi ho parlato ieri?Quelli che sono stati beccati mentre sversavano oli esausti di una friggitoria nel tombino nei pressi di un mercato ai Parioli? https://www.facebook.com/469144566601331/posts/1232082576974189?sfns=mo …pic.twitter.com/ewhttzj8Bn
1;0;0;0;0;Roma, olio esausto nel tombino. Raggi posta su facebook il video che inchioda ambulanti e dipendenti Ama https://www.ilfattoquotidiano.it/2019/04/17/roma-olio-esausto-nel-tombino-dei-parioli-raggi-posta-su-facebook-il-video-che-inchioda-commercianti-e-dipendenti-ama/5117329/ … via @fattoquotidiano
1;0;0;0;0;Tombino in Montenapoleone #Milanopic.twitter.com/Dznpo1LOuK
1;0;0;0;0;Ogni volta che vedo un tombino mi immagino l'iPhone che mi cade e che finisce in una delle fessure
0;1;0;0;0;Tipico tombino romano trasformato in bidone per spazzatura . Ideale per le prossime piogge @romafaschifopic.twitter.com/TRaK8jGUeS
1;0;0;0;0;Spino dorme con la testa poggiata su in tombino e sogna che qualcuno lo porti via.... pic.twitter.com/69uo3eZYcS
1;0;0;0;0;Jonathan ti farei scivolare io. In un tombino.
1;0;0;0;0;Tu che mi hai defollouato:non ce l'ho con te, ora cadrai in un tombino e i ratti ti divoreranno mentre annegherai nella merda, mi spiace.
